PubmedID,Title,Publication Date,Non-academic Author(s),Company Affiliation(s),Corresponding Author Email
39782516,Drug Development.,2024-Dec,"Hong Zhao, Matthew Vasquez, Ju Young Ahn, Wenjuan Dong, Jianting Sheng, Zheng Yin, Stephen T C Wong","Houston Methodist Cancer Center, Houston, TX, USA., Houston Methodist Research Institute, Houston, TX, USA., Houston Methodist Research Institute, Houston, TX, USA., Houston Methodist Research Institute, Houston, TX, USA., Houston Methodist Research Institute, Houston, TX, USA., The TT & WF Chao Center for BRAIN and Houston Methodist Neal Cancer Center, Houston Methodist Hospital, Houston, TX, USA., The TT & WF Chao Center for BRAIN and Houston Methodist Neal Cancer Center, Houston Methodist Hospital, Houston, TX, USA.",
39782515,Drug Development.,2024-Dec,"Wenyan Lu, Keiji Kawatani, Suren Jeevaratnam, Guojun Bu, Takahisa Kanekiyo, Yonghe Li","Mayo Clinic, Jacksonville, FL, USA., Mayo Clinic, Jacksonville, FL, USA., Mayo Clinic, Jacksonville, FL, USA., Mayo Clinic, Jacksonville, FL, USA., Mayo Clinic, Jacksonville, FL, USA., Mayo Clinic, Jacksonville, FL, USA.",
39782501,Drug Development.,2024-Dec,"Eduardo Cortes Gomez, Wang Jianmin","Roswell Park Cancer Institute, Buffalo, NY, USA., Roswell Park Cancer Institute, Buffalo, NY, USA.",
39782456,Drug Development.,2024-Dec,"Akash G Patel, Muhammad T Soliman, Lia Ficaro, Bharti P Nehete, Sohail Karimi, Fengzhu Wang, Hakyoung Kim, Lawrence E Williams, Pramod N Nehete, Drew R Jones, Thomas Wisniewski, Henrieta Scholtzova","NYU Grossman School of Medicine, New York, NY, USA., NYU Grossman School of Medicine, New York, NY, USA., NYU Langone Health, New York, NY, USA., UT MD Anderson Cancer Center, Michale E. Keeling Center for Comparative Medicine and Research, Bastrop, TX, USA., NYU Grossman School of Medicine, New York, NY, USA., NYU Grossman School of Medicine, New York, NY, USA., NYU Grossman School of Medicine, New York, NY, USA., UT MD Anderson Cancer Center, Michale E. Keeling Center for Comparative Medicine and Research, Bastrop, TX, USA., UT MD Anderson Cancer Center, Michale E. Keeling Center for Comparative Medicine and Research, Bastrop, TX, USA., NYU Langone Health, New York, NY, USA., NYU Grossman School of Medicine, New York, NY, USA., NYU Grossman School of Medicine, New York, NY, USA.",
39782258,Dementia Care Research and Psychosocial Factors.,2024-Dec,"Carolyn Langlois, Brian L Egleston, Jessica B Langbaum","Banner Alzheimer's Institute, Phoenix, AZ, USA., Fox Chase Cancer Center, Philadelphia, PA, USA., Banner Alzheimer's Institute, Phoenix, AZ, USA.",
39782221,Dementia Care Research and Psychosocial Factors.,2024-Dec,"Barbara Ukropcová, Ali Amiri, Lucia Slobodova, Karin Marček Malenovská, Katarina Rerkova, Martin Schön, Viera Litvakova, Jozef Ukropec","Biomedical Research Center, Slovak Academy of Sciences, Bratislava, Slovakia., Biomedical Research Center, Slovak Academy of Sciences, Bratislava, Slovakia., Biomedical Research Center, Slovak Academy of Sciences, Bratislava, Slovakia., Biomedical Research Center, Slovak Academy of Sciences, Bratislava, Slovakia., Biomedical Research Center, Slovak Academy of Sciences, Bratislava, Slovakia., Biomedical Research Center, Slovak Academy of Sciences, Bratislava, Slovakia., Biomedical Research Center, Slovak Academy of Sciences, Bratislava, Slovakia., Biomedical Research Center, Slovak Academy of Sciences, Bratislava, Slovakia.",
39781954,Dementia Care Practice.,2024-Dec,Maggie Britton,"MD Anderson Cancer Center, Houston, TX, USA.",
39781751,Intracellular Co-Delivery of Carbon Monoxide and Nitric Oxide Induces Mitochondrial Apoptosis for Cancer Therapy.,2025-Jan-09,,,
39781734,"Marine-Derived Compound Targeting mTOR and FGFR-2: A Promising Strategy for Breast, Lung, and Colorectal Cancer Therapy.",2025-Jan-07,Prabhu D,"Centre for Bioinformatics, Department of Biotechnology, Karpagam Academy of Higher Education, Coimbatore - 641021, India.",
39781731,Observation on the Therapeutic Efficacy of Camrelizumab Combined with Chemotherapy in Non-small Cell Lung Cancer and the Cutaneous Immune-related Adverse Events: A Retrospective Study.,2025-Jan-07,,,
39781729,Benzimidazole Derivatives in Breast Cancer: Target-Specific Therapeutic Breakthroughs.,2025-Jan-07,,,
39781724,A Novel Prognostic Risk Model Based on Oxidative Stress to Predict Survival and Improve Treatment Strategies in Stomach Adenocarcinoma.,2025-Jan-07,,,
39781718,CRISPR/Cas System: A Powerful Strategy to Improve Monogenic Human Diseases as Therapeutic Delivery; Current Applications and Challenges.,2025-Jan-07,Farzaneh Khani,"Department of Stem Cell and Regenerative Medicine, Institute of Medical Biotechnology, National Institute of Genetic Engineering & Biotechnology (NIGEB), 14965161, Tehran, Iran.",
39781716,pH-sensitive Silk Fibroin Nanoparticles Encapsulating Β-Hydroxyisovalerylshikonin for Targeted Pancreatic Cancer Therapy.,2025-Jan-07,,,
39781604,Machine Learning-Assisted Prediction of Photothermal Metal-Phenolic Networks.,2025-Jan-09,,,
39781586,Prognostic Value of Tumor Regression Grade Combined with Pathological Lymph Node Status in Initially Node-Positive Rectal Cancer Treated with Neoadjuvant Chemoradiotherapy.,2025-Jan-03,,,
39781576,Patient and Caregiver Perceptions of Caregiving Contributions During Cancer Clinical Trials: A Mixed-Methods Study.,2025-Jan,,,
39781572,Pretreatment Fatigue in Breast Cancer Patients: Comparison With Healthy Controls and Associations With Biopsychosocial Variables.,2025-Jan,"Patricia Blickle, Martina E Schmidt, Karen Steindorf","Division of Physical Activity, Prevention and Cancer, German Cancer Research Center (DKFZ), Heidelberg, Germany., Division of Physical Activity, Prevention and Cancer, German Cancer Research Center (DKFZ), Heidelberg, Germany., Division of Physical Activity, Prevention and Cancer, German Cancer Research Center (DKFZ), Heidelberg, Germany.",
39781570,Exploring vimentin's role in breast cancer via PICK1 alternative polyadenylation and the miR-615-3p-PICK1 interaction.,2025,,,
39781520,PUF60 Promotes Chemoresistance Through Drug Efflux and Reducing Apoptosis in Gastric Cancer.,2025,,,
39781469,Downregulated CCND3 Is a Key Event Driving Lung Adenocarcinoma Metastasis during Acquired Cisplatin Resistance.,2025,"Chao Cheng, Beixian Zhou, Weiyi Fang, Zhen Liu","Department of Otolaryngology, Shenzhen Longgang Otolaryngology Hospital, Shenzhen 518172, China., The People's Hospital of Gaozhou, Gaozhou 525200, China., The People's Hospital of Gaozhou, Gaozhou 525200, China., The People's Hospital of Gaozhou, Gaozhou 525200, China.",
39781466,S6K1 is a Targetable Vulnerability in Tumors Exhibiting Plasticity and Therapy Resistance.,2025,,,
39781459,"New insights into mitochondrial quality control in anthracycline-induced cardiotoxicity: molecular mechanisms, therapeutic targets, and natural products.",2025,,,
39781457,The Cyclin-Dependent Kinase 8 Inhibitor E966-0530-45418 Attenuates Pulmonary Fibrosis ,2025,,,
39781447,Smad2 Cooperating with TGIF2 Contributes to EMT and Cancer Stem Cells Properties in Pancreatic Cancer via Co-Targeting SOX2.,2025,"Matthias Ilmer, Bernhard W Renz","German Cancer Consortium (DKTK), Partner Site Munich and German Cancer Research Center (DKFZ), Heidelberg, Germany., German Cancer Consortium (DKTK), Partner Site Munich and German Cancer Research Center (DKFZ), Heidelberg, Germany.",
39781381,Anti-Mesothelin CAR-NK cells as a novel targeted therapy against cervical cancer.,2024,"Ivana Kutle, Robert Polten, Jan Lennart Stalp, Jens Hachenberg, Felix Todzey, Ralf Hass, Katharina Zimmermann, Juliane von der Ohe, Constantin von Kaisenberg, Lavinia Neubert, Jan C Kamp, Dirk Schaudien, Ann-Kathrin Seyda, Peter Hillemanns, Rüdiger Klapdor, Michael Alexander Morgan, Axel Schambach","Institute of Experimental Hematology, Hannover Medical School, Hannover, Germany., Institute of Experimental Hematology, Hannover Medical School, Hannover, Germany., Institute of Experimental Hematology, Hannover Medical School, Hannover, Germany., Institute of Experimental Hematology, Hannover Medical School, Hannover, Germany., Institute of Experimental Hematology, Hannover Medical School, Hannover, Germany., Department of Gynecology and Obstetrics, Hannover Medical School, Hannover, Germany., Institute of Experimental Hematology, Hannover Medical School, Hannover, Germany., Department of Gynecology and Obstetrics, Hannover Medical School, Hannover, Germany., Department of Gynecology and Obstetrics, Hannover Medical School, Hannover, Germany., Institute of Pathology, Hannover Medical School, Hannover, Germany., Biomedical Research in Endstage and Obstructive Lung Disease Hannover (BREATH), German Center for Lung Research (DZL), Hannover, Germany., Fraunhofer Institute for Toxicology and Experimental Medicine, ITEM, Hannover, Germany., Institute of Experimental Hematology, Hannover Medical School, Hannover, Germany., Department of Gynecology and Obstetrics, Hannover Medical School, Hannover, Germany., Institute of Experimental Hematology, Hannover Medical School, Hannover, Germany., Institute of Experimental Hematology, Hannover Medical School, Hannover, Germany., Institute of Experimental Hematology, Hannover Medical School, Hannover, Germany.",
39781376,A case of pityriasis rubra pilaris secondary to ponatinib.,2025,Julie Desrochers,"Departement of Dermatology, Charles-Le Moyne Hospital, Longueuil, QC, Canada.",
39781363,Cold exposure reinstates NAD,2024,"Tatiana P Grazioso, Maria Del Mar Rigual, Cristian Perna, Eduardo J Caleiras, Nabil Djouder","Growth Factors, Nutrients and Cancer Group, Molecular Oncology Programme, Centro Nacional de Investigaciones Oncológicas (CNIO) Madrid, ES28029 Spain., Growth Factors, Nutrients and Cancer Group, Molecular Oncology Programme, Centro Nacional de Investigaciones Oncológicas (CNIO) Madrid, ES28029 Spain., Department of Pathology, Hospital Universitario Ramón y Cajal, IRYCIS Madrid, ES28034 Spain., Histopathology Core Unit Madrid, ES-28029 Spain., Growth Factors, Nutrients and Cancer Group, Molecular Oncology Programme, Centro Nacional de Investigaciones Oncológicas (CNIO) Madrid, ES28029 Spain.",
39781350,A Novel Oncolytic Virus Formulation Based on Mesenchymal Stem Cell-Derived Vesicles for Tumor Therapy.,2025,,,
39781349,Lasalocid inhibits melanoma by down-regulating FOXM1 through PI3K/AKT and JNK/P38 MAPK pathways.,2025,,,
39781346,Radiation Therapy Improves Survival in Patients with Distant Metastatic Head and Neck Squamous Cell Carcinoma: A Retrospective Study.,2025,,,
39781342,The Clinical Prediction Value of the Ubiquitination Model Reflecting the Microenvironment Infiltration and Drug Sensitivity in Breast Cancer.,2025,,,
39781339,Unlocking the Hidden Potential of Cancer Therapy Targeting Lysine Succinylation.,2025,,,
39781240,Real-world effectiveness and safety of second- or third-line pegylated liposomal irinotecan plus 5-fluorouracil and folinic acid in pancreatic ductal adenocarcinoma in Spain.,2025,"Rafael Álvarez-Gallego, Roberto Pazo-Cid, Borja López de San Vicente, Teresa Macarulla, Eva Martinez, Fernando Garicano, Irene Hernández, Monica Granja, Ismael Ghanem, Joaquina Martinez, Paula Ribera, Roberto Diaz, Jose Ignacio Martin Valadés, Maria Cristina Angeles, Antonio Cubillo","Centro Integral Oncológico Clara Campal HM CIOCC, Hospital Universitario HM Sanchinarro, C\ Oña Nº10, Madrid 28050, Spain., Hospital Universitario Miguel Servet, Zaragoza, Spain., Hospital Universitario de Basurto, Bilbao, Spain., Vall d'Hebrón Institute of Oncology (VHIO), Hospital Universitario Vall d'Hebrón, Barcelona, Spain., Hospital Universitario Marques de Valdecilla, Santander, Spain., Hospital de Galdakao-Usansolo, Galdakao, Spain., Complejo Hospitalario de Navarra, Pamplona, Spain., Hospital Clínico San Carlos, Madrid, Spain., Hospital La Paz, Madrid, Spain., Instituto de Investigación Biosanitaria de Granada (ibs.GRANADA), Hospital Universitario Virgen de las Nieves, Granada, Spain., Hospital Universitario Parc Tauli, Sabadell, Barcelona, Spain., Hospital Universitario y Politécnico La Fe, Valencia, Spain., Hospital MD Anderson Cancer Center Madrid, Madrid, Spain., Hospital Universitario San Juan de Alicante, Sant Joan d'Alacant, Alicante, Spain., Centro Integral Oncológico Clara Campal HM CIOCC, Hospital Universitario HM Sanchinarro, Madrid, Spain.",
39781239,Navigating the landscape of neoadjuvant immunotherapy for NSCLC: progress and controversies.,2025,,,
39781200,Endovascular interventions in cancer patients with compromise of the mediastinal vasculature: a review.,2024,,,
39781199,Current immunotherapy for thymic epithelial tumors: a narrative review.,2024,Yoko Yamamoto,"Department of General Thoracic Surgery, Sakai City Medical Center, Osaka, Japan.",
39781192,Occult breast cancer in an older woman: A case report.,2025-Feb,,,
39781173,A Case of Small-Cell Lung Cancer With Novel Anaplastic Lymphoma Kinase Gene Rearrangement That Developed Intradural Extramedullary Spinal Metastases With Myelitis.,2024-Dec,Taira Uehara,"Epilepsy and Sleep Center, Fukuoka Sanno Hospital, Fukuoka, JPN.",
39781040,Therapeutic potential of a systemically applied humanized monoclonal antibody targeting Toll‑like receptor 2 in atopic‑dermatitis‑like skin lesions in a mouse model.,2025-Mar,,,
39781038,Prognostic significance of MRD and its correlation with arsenic concentration in pediatric acute promyelocytic leukemia: a retrospective study by SCCLG-APL group.,2025,"Hui-Rong Mai, Wan-Li Li, Ri-Yang Liu, Guo-Hua Chen","Department of Haematology and Oncology, Shenzhen Children's Hospital, Shenzhen, Guangdong, China., Department of Haematology, Hunan Children's Hospital, Changsha, Hunan, China., Department of Paediatrics, Huizhou Central People's Hospital, Huizhou, Guangdong, China., Department of Paediatrics, First People's Hospital of Huizhou, Huizhou, Guangdong, China.",
39781016,The Mindful Compassion Program Integrated with Body-Mind-Spirit Empowerment for Reducing Depression in Lung Cancer Patient-Caregiver Dyads.,2025-Jan,,,
39780997,"Medicine availability and affordability for paediatric cancers, China.",2025-Jan-01,"Huangqianyu Li, Avram Denburg, Sumit Gupta","Division of Haematology/Oncology, The Hospital for Sick Children, Toronto, Canada., Division of Haematology/Oncology, The Hospital for Sick Children, Toronto, Canada., Division of Haematology/Oncology, The Hospital for Sick Children, Toronto, Canada.",
39780958,Intratumoral Injection of Engineered ,2025,,,
39780923,Risk-adapted stereotactic body radiation therapy delivered in four fractions in patients with non-small cell lung cancer.,2024-Nov,"Yutaka Masuoka, Takuhito Tada, Shogo Matsuda, Yoshikazu Hasegawa, Kentaro Ishii","Department of Radiology, Izumi City General Hospital, Izumi, Japan., Department of Radiology, Izumi City General Hospital, Izumi, Japan., Department of Radiology, Izumi City General Hospital, Izumi, Japan., Department of Medical Oncology, Izumi City General Hospital, Izumi, Japan., Department of Radiation Oncology, Tane General Hospital, Osaka, Japan.",
39780816,Clinicopathologic and genomic features associated with brain metastasis after resection of lung adenocarcinoma.,2024-Dec,"Elizabeth G Dunne, Cameron N Fick, Brooke Mastrogiacomo, Kay See Tan, Nicolas Toumbacaris, Stijn Vanstraelen, Gaetano Rocco, Jaime E Chaft, Puneeth Iyengar, Daniel Gomez, Prasad S Adusumilli, Bernard J Park, James M Isbell, Matthew J Bott, Smita Sihag, Daniela Molena, James Huang, David R Jones","Thoracic Service, Department of Surgery, Memorial Sloan Kettering Cancer Center, New York, NY., Thoracic Service, Department of Surgery, Memorial Sloan Kettering Cancer Center, New York, NY., Thoracic Service, Department of Surgery, Memorial Sloan Kettering Cancer Center, New York, NY., Department of Epidemiology and Biostatistics, Memorial Sloan Kettering Cancer Center, New York, NY., Department of Epidemiology and Biostatistics, Memorial Sloan Kettering Cancer Center, New York, NY., Thoracic Service, Department of Surgery, Memorial Sloan Kettering Cancer Center, New York, NY., Thoracic Service, Department of Surgery, Memorial Sloan Kettering Cancer Center, New York, NY., Druckenmiller Center for Lung Cancer Research, Memorial Sloan Kettering Cancer Center, New York, NY., Druckenmiller Center for Lung Cancer Research, Memorial Sloan Kettering Cancer Center, New York, NY., Druckenmiller Center for Lung Cancer Research, Memorial Sloan Kettering Cancer Center, New York, NY., Thoracic Service, Department of Surgery, Memorial Sloan Kettering Cancer Center, New York, NY., Thoracic Service, Department of Surgery, Memorial Sloan Kettering Cancer Center, New York, NY., Thoracic Service, Department of Surgery, Memorial Sloan Kettering Cancer Center, New York, NY., Thoracic Service, Department of Surgery, Memorial Sloan Kettering Cancer Center, New York, NY., Thoracic Service, Department of Surgery, Memorial Sloan Kettering Cancer Center, New York, NY., Thoracic Service, Department of Surgery, Memorial Sloan Kettering Cancer Center, New York, NY., Thoracic Service, Department of Surgery, Memorial Sloan Kettering Cancer Center, New York, NY., Thoracic Service, Department of Surgery, Memorial Sloan Kettering Cancer Center, New York, NY.",
39780756,Cardiovascular toxicity induced by TKIs in patients with chronic myeloid leukaemia: Are women and men different?,2025-Jan-09,,,
39780692,Asciminib versus bosutinib following 2 or more prior therapies in chronic myeloid leukemia: a plain language summary of the ASCEMBL study.,2025-Jan-09,"Natasha Szuber, Lisa Machado","aDepartment of Hematology, Maisonneuve-Rosemont Hospital, Montreal, Quebec, Canada., cCanadian CML Network.",
39780686,Parkinsonism and Bilateral Facial Palsy after Chimeric Antigen Receptor T-Cell Therapy.,2025-Jan-09,,,
39780649,Modulation of Donor in Purely Organic Triplet Harvesting AIE-TADF Photosensitizer for Image-guided Photodynamic Therapy.,2025-Jan-09,"Debasish Barman, Pachaiyappan Rajamalli, Tapashi Sarmah, Siddhartha Sankar Ghosh, Parameswar Krishnan Iyer","Department of Chemistry, Indian Institute of Technology Guwahati, Guwahati, 781039, India., Materials Research Centre, Indian Institute of Science, Bangalore, 560012, India., Department of Chemistry, Indian Institute of Technology Guwahati, Guwahati, 781039, India., Department of Bioscience and Bioengineering IIT Guwahati, Guwahati, Assam, 781039, India., Department of Chemistry, Indian Institute of Technology Guwahati, Guwahati, 781039, India.",
39780572,,2024-Dec-25,,,
39780544,Raman Spectroscopy and Exosome-Based Machine Learning Predicts the Efficacy of Neoadjuvant Therapy for HER2-Positive Breast Cancer.,2025-Jan-08,,,
39780531,Overexpression of RGPR-p117 reveals anticancer effects by regulating multiple signaling pathways in bone metastatic human breast cancer MDA-MB-231 cells.,2025-Jan,,,
39780503,"Introduction to androgenetics: terminology, approaches, and impactful studies across 60 years.",2025-Jan-08,,,
39780444,Statistical methods to adjust for the effects on intervention compliance in randomized clinical trials where precision treatment rules are being developed.,2025-Mar,"Corina Benjet, Yesica Albor, Mauricio Nuñez-Delgado, Renato Zambrano-Cruz, Carlos C Contreras-Ibáñez, Lorena Cudris-Torres, Francisco R de la Peña, Noé González, José Benjamín Guerrero-López, Raúl A Gutierrez-Garcia, Ana Lucía Jiménez-Peréz, Maria Elena Medina-Mora, Pamela Patiño, Pim Cuijpers, Sarah M Gildea, Chris J Kennedy, Nancy A Sampson, Maria V Petukhova, Jose R Zubizarreta, Ronald C Kessler","Center for Global Mental Health, National Institute of Psychiatry Ramón de la Fuente Muñiz, Mexico City, Mexico., Center for Global Mental Health, National Institute of Psychiatry Ramón de la Fuente Muñiz, Mexico City, Mexico., Departamento de Psicología, Universidad Popular de Cesar, Valledupar, Colombia., Universidad Cooperativa de Colombia, Medellin, Colombia., Departamento de Sociología, Universidad Autónoma Metropolitana, Mexico City, Mexico., Programa de Psicología, Fundación Universitaria del Area Andina, Valledupar, Colombia., Unidad de Fomento a la Investigacion, Direccion de Servicios Clínicos, National Institute of Psychiatry Ramón de la Fuente Muñiz, Mexico City, Mexico., Center for Global Mental Health, National Institute of Psychiatry Ramón de la Fuente Muñiz, Mexico City, Mexico., Departamento de Psiquiatría y Salud Mental, Universidad Nacional Autónoma de México, Mexico City, Mexico., Facultad de Estudios Superiores, Universidad De La Salle Bajío, Salamanca, Guanajuato, Mexico., Facultad de Ciencias Administrativas y Sociales, Universidad Autónoma de Baja California, Ensenada, Mexico., Center for Global Mental Health, National Institute of Psychiatry Ramón de la Fuente Muñiz, Mexico City, Mexico., Center for Global Mental Health, National Institute of Psychiatry Ramón de la Fuente Muñiz, Mexico City, Mexico., Department of Clinical, Neuro-, and Developmental Psychology, Vrije Universiteit, Amsterdam, The Netherlands., Department of Health Care Policy, Harvard Medical School, Boston, Massachusetts, USA., Department of Psychiatry, Center for Precision Psychiatry, Massachusetts General Hospital, Boston, Massachusetts, USA., Department of Health Care Policy, Harvard Medical School, Boston, Massachusetts, USA., Department of Health Care Policy, Harvard Medical School, Boston, Massachusetts, USA., Department of Health Care Policy, Harvard Medical School, Boston, Massachusetts, USA., Department of Health Care Policy, Harvard Medical School, Boston, Massachusetts, USA.",
39780402,Thrombopoietin Receptor Agonists for Thrombocytopenia in Pediatric Hematologic Malignancies.,2025-Jan-08,,,
39780367,FAP-Targeted SPECT/CT and PET/CT Imaging for Breast Cancer Patients.,2025-Jan-09,"Abanoub Nakhla, Parth Doshi, Neeta Pandit-Taskar, Amit Gulati, Asmâa Naim, Mathieu Sinigaglia, Maria Bebawy, Antoine Girard","Department of Surgery, Maimonides Medical Center, New York, NY., Department of Internal Medicine, Lewis Katz School of Medicine, Philadelphia, PA., Department of Radiology, Molecular Imaging and Therapy Service, Memorial Sloan Kettering Cancer Center, New York, NY., Department of Internal Medicine, Maimonides Medical Center, New York, NY., Université Mohammed VI des Sciences et de la Santé, Casablanca, Morocco., Department of Nuclear Medicine, Clinique Pasteur, Toulouse, France., Morristown Medical Center, OBGYN Department, Morristown, NJ., Department of Nuclear Medicine, CHU Amiens-Picardie, Amiens, France.",
39780366,Prevention and Management of Infectious Complications in Pediatric Patients With Cancer: A Survey Assessment of Current Practices Across Children's Oncology Group Institutions.,2025-Jan-08,"Leonora R Slatnick, David Hoogstra, Brian T Fisher, Erin Goode, Kasey Jackson, Caitlin Elgarten, Joel Thompson, Sarah Alexander, Jennifer Hess, Terri Guinipero, Alexandra M Walsh, Daniel K Choi","Department of Pediatrics, Primary Children's Hospital, Salt Lake City, Utah, USA., Department of Pediatrics, Helen Devos Children's Hospital, Grand Rapids, Michigan, USA., Division of Oncology, Children's Hospital of Philadelphia, Philadelphia, Pennsylvania, USA., Division of Pediatric Hematology/Oncology, Children's Hospital of Michigan, Detroit, Michigan, USA., Division of Pediatric Hematology/Oncology, Cook Children's Hospital, Fort Worth, Texas, USA., Division of Oncology, Children's Hospital of Philadelphia, Philadelphia, Pennsylvania, USA., Division of Hematology/Oncology/BMT, Department of Pediatrics, Children's Mercy Hospital, Kansas City, Missouri, USA., Division of Haematology/Oncology, The Hospital for Sick Children, Toronto, Canada., Children's Hospital of Minnesota, Minneapolis, Minnesota, USA., Division of Pediatric Hematology and Oncology, Department of Pediatrics, Nationwide Children's Hospital, Columbus, Ohio, USA., Phoenix Children's Hospital, Phoenix, Arizona, USA., Adocate Children's Hospital Health, Park Ridge, Illinois, USA.",
39780302,"Impact of Tacrolimus, Sirolimus, Age, and Body Mass Index on the Occurrence of Skin Cancer and Islet Dysfunction After Transplantation.",2025,"Christopher Orr, Jeannette Stratton, Mohamed El-Shahawy, Elena Forouhar, Alice Peng, Gagandeep Singh, Keiko Omori, Meirigeng Qi, Fouad Kandeel","Department of Translational Research & Cellular Therapeutics, Arthur Riggs Diabetes & Metabolism Research Institute, City of Hope, Duarte, CA, USA., Department of Translational Research & Cellular Therapeutics, Arthur Riggs Diabetes & Metabolism Research Institute, City of Hope, Duarte, CA, USA., Department of Translational Research & Cellular Therapeutics, Arthur Riggs Diabetes & Metabolism Research Institute, City of Hope, Duarte, CA, USA., Department of Translational Research & Cellular Therapeutics, Arthur Riggs Diabetes & Metabolism Research Institute, City of Hope, Duarte, CA, USA., Kidney & Pancreas Transplant Program, Cedars-Sinai Medical Center, Los Angeles, CA. USA., Department of Translational Research & Cellular Therapeutics, Arthur Riggs Diabetes & Metabolism Research Institute, City of Hope, Duarte, CA, USA., Department of Translational Research & Cellular Therapeutics, Arthur Riggs Diabetes & Metabolism Research Institute, City of Hope, Duarte, CA, USA., Department of Translational Research & Cellular Therapeutics, Arthur Riggs Diabetes & Metabolism Research Institute, City of Hope, Duarte, CA, USA., Department of Translational Research & Cellular Therapeutics, Arthur Riggs Diabetes & Metabolism Research Institute, City of Hope, Duarte, CA, USA.",
39780291,MORF4L2 induces immunosuppressive microenvironment and immunotherapy resistance through GRHL2/MORF4L2/H4K12Ac/CSF1 axis in triple-negative breast cancer.,2025-Jan-09,,,
