PubmedID,Title,Publication Date,Non-academic Author(s),Company Affiliation(s),Corresponding Author Email
39786725,Synthesis and Application of a Novel Multifunctional Nanoprodrug for Synergistic Chemotherapy and Phototherapy with Hydrogen Sulfide Gas.,2025-Jan-09,Lianghui Zhu,"Jiang Xi Institute for Drug Control, Jiangxi Provincial Drug Administration, 1566 Beijing East Road, Nanchang, Jiangxi 330029, China.",
39786676,'Nomadic' Hematopoietic Stem Cells Navigate the Embryonic Landscape.,2025-Jan-09,"Anand Badhri Narayan, Senthil Kumar Hariom, Ayan Prasad Mukherjee, Deotima Das, Aadhira Nair, Everette Jacob Remington Nelson","Department of Integrative Biology, Gene Therapy Laboratory, School of Bio Sciences and Technology, Vellore Institute of Technology, Vellore, TN, 632 014, India., Department of Integrative Biology, Gene Therapy Laboratory, School of Bio Sciences and Technology, Vellore Institute of Technology, Vellore, TN, 632 014, India., Department of Integrative Biology, Gene Therapy Laboratory, School of Bio Sciences and Technology, Vellore Institute of Technology, Vellore, TN, 632 014, India., Department of Integrative Biology, Gene Therapy Laboratory, School of Bio Sciences and Technology, Vellore Institute of Technology, Vellore, TN, 632 014, India., Department of Integrative Biology, Gene Therapy Laboratory, School of Bio Sciences and Technology, Vellore Institute of Technology, Vellore, TN, 632 014, India., Department of Integrative Biology, Gene Therapy Laboratory, School of Bio Sciences and Technology, Vellore Institute of Technology, Vellore, TN, 632 014, India. everette.nelson@gmail.com.",everette.nelson@gmail.com.
39786672,HAIC plus lenvatinib and tislelizumab for advanced hepatocellular carcinoma with Vp4 portal vein invasion.,2025-Jan-09,"Feng Shi, Ping Ma, Yuanmin Zhou","Department of Interventional Radiology, Guangdong Provincial People's Hospital, Guangzhou, 519041, China., Department of Oncology, The Twelfth People's Hospital of Guangzhou, Guangzhou, 510620, China., Department of Oncology, The Twelfth People's Hospital of Guangzhou, Guangzhou, 510620, China.",
39786650,Survival benefit of cancer-directed surgery and the role of adjuvant therapy in malignant major salivary gland cancers: a propensity score matched retrospective analysis.,2025-Jan-09,,,
39786597,Costal fracture assessment for relief and enhancement of quality of life-CARE study.,2025-Jan-09,,,
39786586,Implant-based reconstruction and adjuvant radiotherapy in breast cancer patients-current status and DEGRO recommendations.,2025-Jan-09,"R Baumann, P Feyer, W Harms, T Hehr","Department of Radiation Oncology, St. Marien-Krankenhaus, Siegen, Germany., Formerly Department of Radiation Oncology, Vivantes Hospital Neukölln, Berlin, Germany., Department of Radiation Oncology, St. Claraspital, Basel, Switzerland., Department of Radiation Oncology, Marienhospital Stuttgart, Stuttgart, Germany.",
39786540,Correlation between skin cancer and therapy with anti-IL monoclonal antibodies in patients affected by moderate-to-severe psoriasis: an observational monocentric study.,2025-Jan-07,Giovanni Bagnoni,"Melanoma and Skin Cancer Unit, AVNO Tuscany, Livorno.",
39786519,Computational screening and molecular dynamics of natural compounds targeting the SH2 domain of STAT3: a multitarget approach using network pharmacology.,2025-Jan-09,Nitesh Kumar,"Department of Pharmacology and Toxicology, National Institute of Pharmaceutical Education and Research, Hajipur, Vaishali, Bihar, 844102, India.",
39786518,Surgical treatment can provide the opportunity for in-vitro fertilization (IVF) in a shorter period of time for patients with early-stage endometrial cancer.,2025-Jan-09,,,
39786504,"Melanoma detection, treatment, survival, and mortality through year 2 of the pandemic.",2025-Jan-09,,,
39786493,Contemporary prostate cancer radiation therapy trials may underestimate the risk of biochemical recurrence.,2024-Dec-30,"Michael West, Jose M Flores, John P Mulhall","Sexual & Reproductive Medicine Program, Urology Service, Memorial Sloan Kettering Cancer Center, New York, NY 10065, United States., Sexual & Reproductive Medicine Program, Urology Service, Memorial Sloan Kettering Cancer Center, New York, NY 10065, United States., Sexual & Reproductive Medicine Program, Urology Service, Memorial Sloan Kettering Cancer Center, New York, NY 10065, United States.",
39786465,Activity and safety of avelumab in high-grade neuroendocrine tumors and poorly differentiated neuroendocrine carcinomas progressive after chemotherapy (AveNEC trial).,2024-Dec-30,"Leonidas Apostolidis, Barbara Grün, Peter R Galle","National Center for Tumor Diseases, Heidelberg, Germany., National Center for Tumor Diseases, Heidelberg, Germany., Universitätsmedizin Mainz, Mainz, Germany.",
39786457,The impact of neoadjuvant therapy on the prognostic value of preoperative neutrophil-to-lymphocyte ratio for colorectal liver metastases: a multi-center cohort study.,2025-Jan-09,Hong Fu,"Department of Hepatobiliary Surgery, Shaoxing People's Hospital, Shaoxing, Zhejiang, China.",
39786430,Phase 2 Open-Label Trial of Brentuximab Vedotin with Pembrolizumab in PD-1 Pretreated Metastatic Non-Small Cell Lung Cancer and Metastatic Cutaneous Melanoma.,2024-Dec-30,"Omid Hamid, Robert Jotte, Amanda Gillespie-Twardy, Inderjit Mehmi, Graham Watson, Patrick Ward, Marya Chaney, Hailing Lu, Jason Berndt, Brian P O'Connor, Kapil Rathi, Eeman Shaikh","The Angeles Clinic and Research Institute, a Cedars Sinai Affiliate, Los Angeles, CA, United States., Rocky Mountain Cancer Centers and US Oncology, United States., Blue Ridge Cancer Care, United States., Cedars-Sinai Medical Center, Los Angeles, CA, United States., Virginia Oncology Associates, United States., Oncology Hematology Care, Cincinnati, Ohio, United States., Merck & Co, North Wales, PA, United States., Immune Design, Seattle, WA, United States., Pfizer, Bothell, WA, United States., Pfizer (United States), Bothell, Washington, United States., Pfizer, Bothell, WA, United States., Pfizer, Bothell, WA, United States.",
39786420,Switching Drivers: Epigenetic Rewiring to Genetic Progression in Glioma.,2024-Dec-30,"Kristen L Drucker, Robert B Jenkins, Daniel Schramek","Mayo Clinic, Rochester, United States., Mayo Clinic, Rochester, MN, United States., Lunenfeld-Tanenbaum Research Institute, Toronto, Canada.",
39786418,High-Risk MCL: Recognition and Treatment.,2024-Dec-30,,,
39786401,"OBI-992, a Novel TROP2-Targeted Antibody-Drug Conjugate, Demonstrates Antitumor Activity in Multiple Cancer Models.",2024-Dec-30,"Wan-Fen Li, Ming-Feng Chiang, Hao-Cheng Weng, Jhih-Jie Yang, Hsin-Shan Wu, Szu-Yu Wu, Yu-Jung Chen, Chi-Huan Lu, Jyy-Shiuan Tu, Ren-Yu Hsu, Chi-Sheng Shia, Teng-Yi Huang, Ming-Tain Lai","OBI Pharma, Inc., Taipei, Taiwan., OBI Pharma, Inc., Taipei, Taiwan., OBI Pharma, Inc., Taipei, Taiwan., OBI Pharma, Inc., Taipei, Taiwan., OBI Pharma, Inc., Taipei, Taiwan., OBI Pharma, Inc., Taipei, Taiwan., OBI Pharma, Inc., Taipei, Taiwan., OBI Pharma, Inc., Taipei, Taiwan., OBI Pharma, Inc., Taipei, Taiwan., OBI Pharma, Inc., Taipei, Taiwan., OBI Pharma, Inc., Taipei, Taiwan., OBI Pharma, Inc., Taipei, Taiwan., OBI Pharma, Inc., Taipei, Taiwan.",
39786391,Outcomes of Older Adults and Frail Patients Receiving Idecabtagene Vicleucel: A CIBMTR Study.,2024-Dec-30,"Temitope Oloyede, Ruta Brazauskas, Hamza Hashmi, Doris K Hansen, Christopher J Ferreri, Devender S Dhanda, Melanie J Harrison, Amani Kitali, Heather J Landau, Abu-Sayeef Mirza, Jinalben Patel, Pallavi Patwardhan, Muzaffar H Qazilbash, Taiga Nishihori, Lohith Gowda, Saad Z Usmani, Ciara L Freeman","Center for International Blood and Marrow Transplantation Research, United States., Center for International Blood and Marrow Transplantation Research, United States., Memorial Sloan Kettering Cancer Center, New York, New York, United States., H. Lee Moffitt Cancer Center and Research Institute, Tampa, Florida, United States., Atrium Health Wake Forest Baptist Levine Cancer Institute, Charlotte, North Carolina, United States., Bristol Myers Squibb, Princeton, New Jersey, United States., Bristol Myers Squibb, Lawrenceville, New Jersey, United States., Bristol Myers Squibb, Princeton, New Jersey, United States., Memorial Sloan-Kettering Cancer Center, New York, New York, United States., Moffitt Cancer Center, Tampa, Florida, United States., Memorial Sloan Kettering Cancer Center, United States., Bristol Myers Squibb, Princeton, New Jersey, United States., M.D. Anderson Cancer Center, Houston, Texas, United States., Moffitt Cancer Center, Tampa, Florida, United States., Yale School of Medicine, New Haven, Connecticut, United States., Memorial Sloan Kettering Cancer Center, New York, New York, United States., H. Lee Moffitt Cancer Center, Tampa, Florida, United States.",
39786390,Odronextamab monotherapy in R/R DLBCL after progression with CAR T-cell therapy: Primary analysis of the ELM-1 study.,2024-Dec-30,"Max S Topp, Matthew J Matasar, Stephen M Ansell, Jeffrey A Barnes, Jon E Arnason, Jean-Marie Michot, Susan M O'Brien, Yuan Cheng, Dina M Flink, Min Zhu, Jurriaan Brouwer-Visser, Aafia Chaudhry, Hesham Mohamed, Srikanth Ambati, Jennifer L Crombie","Universitätsklinikum Würzburg, Würzburg, Germany., Rutgers Cancer Institute of New Jersey, New Brunswick, New Jersey, United States., Mayo Clinic, Rochester, Minnesota, United States., Massachusetts General Hospital, Harvard Medical School, Boston, Massachusetts, United States., Beth Israel Deaconess Medical Center, Boston, Massachusetts, United States., Gustave Roussy, Université Paris-Saclay, Drug Development Department, Villejuif, F-94805, France, Viellejuif, France., Chao Family Comprehensive Cancer Center at UC Irvine Medical Center, Orange, California, United States., Regeneron Pharmaceuticals, Inc., Tarrytown, New York, United States., Regeneron Pharmaceuticals, Inc., Tarrytown, New York, United States., Regeneron Pharmaceuticals, Inc., Regeneron, Tarrytown, New York, United States., Regeneron Pharmaceuticals, Inc., Tarrytown, New York, United States., Regeneron Pharmaceuticals, Inc., Tarrytown, New York, United States., Regeneron Pharmaceuticals, Inc., Tarrytown, New York, United States., Dana-Farber Cancer Institute, Boston, Massachusetts, United States.",
39785866,Ultrasensitive Detection and Monitoring of Circulating Tumor DNA using Structural Variants in Early-Stage Breast Cancer.,2025-Jan-09,"Karen Howarth, Jesús Fuentes Antrás, Philippe Echelard, Eitan Amir, Elizabeth Shah, Celeste Yu, Scott Bratman, Taylor Bird, Elza C de Bruin, Christopher Rushton, Sofia Birkeälv, Miguel Alcaide, Lucia Oton, Girish Putcha, Samuel Woodhouse, Hal K Berman, David W Cescon","SAGA Dx, Morrisville, North Carolina, United States., NEXT Oncology, Madrid, Spain., Université de Sherbrooke, Sherbrooke, Quebec, Canada., Princess Margaret Cancer Centre, Toronto, Canada., Princess Margaret Cancer Centre, Toronto, Ontario, Canada., Princess Margaret Cancer Centre, Toronto, ON, Canada., Princess Margaret Cancer Centre, Toronto, Ontario, Canada., Princess Margaret Cancer Centre, Toronto, Ontario, Canada., AstraZeneca (Australia), Cambridge, United Kingdom., SAGA Dx, Morrisville, North Carolina, United States., SAGA Dx, Morrisville, North Carolina, United States., SAGA Diagnostics AB, Lund, Sweden., SAGA Diagnostics AB, Lund, Sweden., SAGA Dx, Morrisville, North Carolina, United States., SAGA Dx, Morrisville, United States., Princess Margaret Cancer Centre, Toronto, Ontario, Canada., Princess Margaret Cancer Centre, Toronto, Ontario, Canada.",
39785827,TBK1 Targeting Is Identified as a Therapeutic Strategy to Enhance CAR T-Cell Efficacy Using Patient-Derived Organotypic Tumor Spheroids.,2025-Jan-09,"Yi Sun, Luke Maggs, Apekshya Panda, Samuel J Wright, Angelina M Cicerchia, Anne Jenney, Matthew D Perricone, Caitlin E Mills, Giulia Cattaneo, Marco Ventin, Feng Chen, Martin Q Rasmussen, Alex Miranda, Or-Yam Revach, Jacy Fang, Amina Fu, Peter J Bowling, Tatyana Sharova, Aleigha Lawless, Peter K Sorger, Nabeel Bardeesy, Xinhui Wang, Keith T Flaherty, Genevieve M Boland, Arnav Mehta, Moshe Sade-Feldman, Cristina R Ferrone, Russell W Jenkins","Mass General Cancer Center, Krantz Family Center for Cancer Research, Department of Medicine, Massachusetts General Hospital, Harvard Medical School, Boston, Massachusetts., Division of Gastrointestinal and Oncologic Surgery, Department of Surgery, Massachusetts General Hospital, Harvard Medical School, Boston, Massachusetts., Broad Institute of MIT and Harvard, Cambridge, Massachusetts., Broad Institute of MIT and Harvard, Cambridge, Massachusetts., Mass General Cancer Center, Krantz Family Center for Cancer Research, Department of Medicine, Massachusetts General Hospital, Harvard Medical School, Boston, Massachusetts., Laboratory of Systems Pharmacology, Harvard Program in Therapeutic Sciences, Harvard Medical School, Boston, Massachusetts., Laboratory of Systems Pharmacology, Harvard Program in Therapeutic Sciences, Harvard Medical School, Boston, Massachusetts., Laboratory of Systems Pharmacology, Harvard Program in Therapeutic Sciences, Harvard Medical School, Boston, Massachusetts., Division of Gastrointestinal and Oncologic Surgery, Department of Surgery, Massachusetts General Hospital, Harvard Medical School, Boston, Massachusetts., Division of Gastrointestinal and Oncologic Surgery, Department of Surgery, Massachusetts General Hospital, Harvard Medical School, Boston, Massachusetts., Division of Gastrointestinal and Oncologic Surgery, Department of Surgery, Massachusetts General Hospital, Harvard Medical School, Boston, Massachusetts., Mass General Cancer Center, Krantz Family Center for Cancer Research, Department of Medicine, Massachusetts General Hospital, Harvard Medical School, Boston, Massachusetts., Mass General Cancer Center, Krantz Family Center for Cancer Research, Department of Medicine, Massachusetts General Hospital, Harvard Medical School, Boston, Massachusetts., Mass General Cancer Center, Krantz Family Center for Cancer Research, Department of Medicine, Massachusetts General Hospital, Harvard Medical School, Boston, Massachusetts., Mass General Cancer Center, Krantz Family Center for Cancer Research, Department of Medicine, Massachusetts General Hospital, Harvard Medical School, Boston, Massachusetts., Mass General Cancer Center, Krantz Family Center for Cancer Research, Department of Medicine, Massachusetts General Hospital, Harvard Medical School, Boston, Massachusetts., Division of Gastrointestinal and Oncologic Surgery, Department of Surgery, Massachusetts General Hospital, Harvard Medical School, Boston, Massachusetts., Division of Gastrointestinal and Oncologic Surgery, Department of Surgery, Massachusetts General Hospital, Harvard Medical School, Boston, Massachusetts., Division of Gastrointestinal and Oncologic Surgery, Department of Surgery, Massachusetts General Hospital, Harvard Medical School, Boston, Massachusetts., Laboratory of Systems Pharmacology, Harvard Program in Therapeutic Sciences, Harvard Medical School, Boston, Massachusetts., Mass General Cancer Center, Krantz Family Center for Cancer Research, Department of Medicine, Massachusetts General Hospital, Harvard Medical School, Boston, Massachusetts., Division of Gastrointestinal and Oncologic Surgery, Department of Surgery, Massachusetts General Hospital, Harvard Medical School, Boston, Massachusetts., Mass General Cancer Center, Krantz Family Center for Cancer Research, Department of Medicine, Massachusetts General Hospital, Harvard Medical School, Boston, Massachusetts., Broad Institute of MIT and Harvard, Cambridge, Massachusetts., Mass General Cancer Center, Krantz Family Center for Cancer Research, Department of Medicine, Massachusetts General Hospital, Harvard Medical School, Boston, Massachusetts., Mass General Cancer Center, Krantz Family Center for Cancer Research, Department of Medicine, Massachusetts General Hospital, Harvard Medical School, Boston, Massachusetts., Division of Gastrointestinal and Oncologic Surgery, Department of Surgery, Massachusetts General Hospital, Harvard Medical School, Boston, Massachusetts., Mass General Cancer Center, Krantz Family Center for Cancer Research, Department of Medicine, Massachusetts General Hospital, Harvard Medical School, Boston, Massachusetts.",
39785769,Primary Cilia Formation Mediated by Hsa_Circ_0005185/OTUB1/RAB8A Complex Inhibits Prostate Cancer Progression by Suppressing Hedgehog Signaling Pathway.,2025-Jan-09,,,
39785511,Targeting WDR5/ATAD2 signaling by the CK2/Ikaros axis demonstrates therapeutic efficacy in T-ALL.,2024-Dec-27,,,
39785419,Biomarkers.,2024-Dec,,,
39785181,Public Health.,2024-Dec,"Asao Ogawa, Atsushi Nishida","Division of Psycho-Oncology, Exploratory Oncology Research and Clinical Trial Center, National Cancer Center, Kashiwa, Chiba, Japan., Tokyo Metropolitan Institute of Medical Science, Setagaya-ku, Tokyo, Japan.",
39785081,Public Health.,2024-Dec,"Gavin T Kress, Emily S Popa, David A Merrill, Jennifer E Bramen, Prabha Siddarth","The Icahn School of Medicine at Mount Sinai, New York, NY, USA., Pacific Brain Health Center, Pacific Neuroscience Institute and Foundation, Santa Monica, CA, USA., Pacific Brain Health Center, Pacific Neuroscience Institute and Foundation, Santa Monica, CA, USA., Pacific Brain Health Center, Pacific Neuroscience Institute and Foundation, Santa Monica, CA, USA., Pacific Brain Health Center, Pacific Neuroscience Institute and Foundation, Santa Monica, CA, USA.",
39784999,Public Health.,2024-Dec,"Haixin Zhang, Quanwu Zhang, Amir Abbas Tahami Monfared, Michael C Irizarry","Alzheimer's Disease and Brain Health, Eisai Inc., Nutley, NJ, USA., Alzheimer's Disease Franchise, Eisai Inc., Nutley, NJ, USA., Alzheimer's Disease & Brain Health, Eisai Inc., Nutley, NJ, USA., Eisai Inc., Woodcliff Lake, NJ, USA.",
39784514,Current advance in comprehensive management of hilar cholangiocarcinoma and navigation in surgery: non-systematic reviews.,2024-Dec-31,,,
39784146,Should CAR-T cell therapy be considered a standard of care for patients with refractory diffuse large B-cell lymphoma in second line treatment?,2025-Jan-09,"Lucia Perez-Lamas, Jose Sandoval-Sus, Julio C Chavez","Hospital Ramon y Cajal, Madrid, Spain., Memorial Health Care, Pembroke Pines, USA., Department of Malignant Hematology, Moffitt Cancer Center, Tampa, USA.",
39784117,Examining the use of interoceptive exposure exercises in people with and without a history of chronic physical health problems.,2025-Jan-09,,,
39783918,Folding an RCA Scaffold into an Intelligent Coiled Nanosnake for Precise/Synergistic RNAi-/Chemotherapy of Cancer.,2025-Jan-09,,,
39783859,"Experiences With End-of-Life Care for Patients With Pre-Existing Severe Mental Disorders, Their Relatives, and Healthcare Professionals.",2025-Feb,"Mette Kjærgaard Nielsen, Poul Videbech","The Research Unit for General Practice, Aarhus, Denmark., Centre for Neuropsychiatric Depression Research, Mental Health Centre Glostrup, Glostrup, Denmark.",
39783856,Baseline FIB-4 May Be a Risk Factor of Recurrence After SBRT in Patients With HBV-Related Small HCC.,2025-Jan,Wengang Li,"Radiation Oncology Department, The Fifth Medical Center of Chinese PLA General Hospital, Beijing, China.",
39783855,Arterial Thromboembolism in Patients With Advanced Lung Cancer: Secondary Analyses of the Rising-VTE/NEJ037 Study.,2025-Jan,"Toshihide Yokoyama, Masahiro Yamasaki, Nobuhisa Ishikawa","Department of Respiratory Medicine, Kurashiki Central Hospital, Kurashiki, Japan., Department of Respiratory Disease, Hiroshima Red Cross Hospital and Atomic-Bomb Survivors Hospital, Hiroshima, Japan., Department of Respiratory Medicine, Hiroshima Prefectural Hospital, Hiroshima, Japan.",
39783849,A Dual-Targeting Biomimetic Nanoplatform Integrates SDT/CDT/Gas Therapy to Boost Synergistic Ferroptosis for Orthotopic Hepatocellular Carcinoma Therapy.,2025-Jan-09,,,
39783838,Metabolic-Immune Suppression Mediated by the SIRT1-CX3CL1 Axis Induces Functional Enhancement of Regulatory T Cells in Colorectal Carcinoma.,2025-Jan-09,,,
39783790,Prognostic Features and Potential for Immune Therapy in Metastatic Mismatch Repair-Deficient Colorectal Cancer: A Retrospective Analysis of a Large Consecutive Population-Based Patient Series.,2025-Jan,"Jukka-Pekka Mecklin, Jan Böhm, Maarit Ahtiainen","Department of Education and Research, The Wellbeing Services of Central Finland, Jyväskylä, Finland., Department of Pathology, Wellbeing Services County of Central Finland, Jyväskylä, Finland., Department of Pathology, Wellbeing Services County of Central Finland, Jyväskylä, Finland.",
39783747,DNA Methylation in Prostate Cancer: Clinical Implications and Potential Applications.,2025-Jan,"Romane Muletier, Céline Bourgne, Laurent Guy, Aurore Dougé","Service d'Oncologie médicale, CHU Gabriel Montpied, Clermont-Ferrand, France., Hématologie Biologique, CHU Estaing, Clermont-Ferrand, France., Service d'Urologie, CHU Gabriel Montpied, Clermont-Ferrand, France., Service d'Oncologie médicale, CHU Gabriel Montpied, Clermont-Ferrand, France.",
39783647,Novel Intraprostatic Magnetic Resonance-Guided Implantation of Multidrug-Eluting Microdevice for Testing of Systemic Therapy Agents In Situ: Proof of Concept in Intermediate-Risk and High-Risk Prostate Cancer: Erratum.,2025-Feb,,,
39782745,Alzheimer's Imaging Consortium.,2024-Dec,,,
39782735,Improving Affinity while Reducing Kidney Uptake of CXCR4-Targeting Radioligands Derived from the Endogenous Antagonist EPI-X4.,2025-Jan-09,"Raghuvir H Gaonkar, Thibaud Bailly, Jacopo Millul, Rosalba Mansi, Melpomeni Fani","Universitatsspital Basel, Radiopharmazeutische Chemie, Petersgraben 4, 4031, Basel, SWITZERLAND., Universitatsspital Basel, Radiopharmazeutische Chemie, Petersgraben 4, 4031, Basel, SWITZERLAND., Universitatsspital Basel, Radiopharmazeutische Chemie, Petersgraben 4, 4031, Basel, SWITZERLAND., Universitatsspital Basel, Radiopharmazeutische Chemie, Petersgraben 4, 4031, Basel, SWITZERLAND., Universitatsspital Basel, Radiopharmazeutische Chemie, Petersgraben 4, 4031, Basel, SWITZERLAND.",
39782693,CD4+ T helper 2 cell-macrophage crosstalk induces IL-24-mediated breast cancer suppression.,2025-Jan-09,"Bo Wang, Yun Xia, Can Zhou, Yuhan Zeng, Heehwa G Son, Shadmehr Demehri","Center for Cancer Immunology and Cutaneous Biology Research Center, Department of Dermatology and Krantz Family Center for Cancer Research, Department of Pathology, Massachusetts General Hospital and Harvard Medical School, Boston, Massachusetts, USA., Center for Cancer Immunology and Cutaneous Biology Research Center, Department of Dermatology and Krantz Family Center for Cancer Research, Department of Pathology, Massachusetts General Hospital and Harvard Medical School, Boston, Massachusetts, USA., Center for Cancer Immunology and Cutaneous Biology Research Center, Department of Dermatology and Krantz Family Center for Cancer Research, Department of Pathology, Massachusetts General Hospital and Harvard Medical School, Boston, Massachusetts, USA., Center for Cancer Immunology and Cutaneous Biology Research Center, Department of Dermatology and Krantz Family Center for Cancer Research, Department of Pathology, Massachusetts General Hospital and Harvard Medical School, Boston, Massachusetts, USA., Center for Cancer Immunology and Cutaneous Biology Research Center, Department of Dermatology and Krantz Family Center for Cancer Research, Department of Pathology, Massachusetts General Hospital and Harvard Medical School, Boston, Massachusetts, USA., Center for Cancer Immunology and Cutaneous Biology Research Center, Department of Dermatology and Krantz Family Center for Cancer Research, Department of Pathology, Massachusetts General Hospital and Harvard Medical School, Boston, Massachusetts, USA.",
39782689,KRASG12D drives immunosuppression in lung adenocarcinoma through paracrine signaling.,2025-Jan-09,"Emily L Lasse-Opsahl, Ivana Barravecchia, Elyse McLintock, Jennifer M Lee, Sarah F Ferris, Rachael Hinshaw, Sophia Cavanaugh, Marzia Robotti, Lily Rober, Kristena Y Abdelmalak, Craig J Galban, Stefanie Galban","Graduate Program in Cancer Biology., Department of Radiology, and., Department of Radiology, and., Department of Radiology, and., Department of Radiology, and., Graduate Program in Cancer Biology., Department of Radiology, and., Department of Radiology, and., Department of Radiology, and., Department of Radiology, and., Department of Radiology, and., Department of Radiology, and.",
39782686,Sustained inhibition of CSF1R signaling augments antitumor immunity through inhibiting tumor-associated macrophages.,2025-Jan-09,"Takahiko Sato, Daisuke Sugiyama, Jun Koseki, Yasuhiro Kojima, Satomi Hattori, Kazuki Sone, Hitomi Nishinakamura, Tomohiro Ishikawa, Takuma Kato, Hiroyoshi Nishikawa","Department of Immunology and., Department of Immunology and., Cellular and Molecular Biotechnology Research Institute, National Institute of Advanced Industrial Science and Technology (AIST), Tokyo, Japan., Laboratory of Computational Life Science, National Cancer Center, Tokyo, Japan., Department of Immunology and., Department of Immunology and., Division of Cancer Immunology, Research Institute / Exploratory Oncology Research & Clinical Trial Center (EPOC), National Cancer Center, Tokyo, Japan., Department of Immunology and., Department of Immunology and., Department of Immunology and.",
39782564,Drug Development.,2024-Dec,,,
39782541,Correction: Camptothecin-based prodrug nanomedicines for cancer therapy.,2025-Jan-09,,,
