PubmedID,Title,Publication Date,Non-academic Author(s),Company Affiliation(s),Corresponding Author Email
39789673,Psychological Distress and Problems Among Young and Middle-Aged Cancer Patients Undergoing Treatment in China.,2025-Jan,,,
39789641,Secreted LGALS3BP facilitates distant metastasis of breast cancer.,2025-Jan-09,"Jeesoo Kim, Jong-Seo Kim","Center for RNA Research, Institute for Basic Science, Seoul, Republic of Korea., Center for RNA Research, Institute for Basic Science, Seoul, Republic of Korea.",
39789640,Effect of daily alcohol intake on sex hormone levels among postmenopausal breast cancer survivors on aromatase inhibitor therapy: a randomized controlled crossover pilot study.,2025-Jan-09,"Elizabeth Mostofsky, Julie E Buring, Steven E Come, Nadine M Tung, Cancan Zhang, Kenneth J Mukamal","Department of Epidemiology (EM, JEB) and Nutrition (KJM), Harvard T.H. Chan School of Public Health, 677 Huntington Ave, Kresge 505-B, Boston, MA, 02115, USA. elm225@mail.harvard.edu., Department of Epidemiology (EM, JEB) and Nutrition (KJM), Harvard T.H. Chan School of Public Health, 677 Huntington Ave, Kresge 505-B, Boston, MA, 02115, USA., Department of Medicine (SEC, NMT, CZ, KJM), Beth Israel Deaconess Medical Center, Harvard Medical, School, Boston, MA, USA., Cancer Risk and Prevention Program and Breast Medical Oncology, Beth Israel Deaconess Medical Center, Harvard Medical, School, Boston, MA, USA., Department of Medicine (SEC, NMT, CZ, KJM), Beth Israel Deaconess Medical Center, Harvard Medical, School, Boston, MA, USA., Department of Epidemiology (EM, JEB) and Nutrition (KJM), Harvard T.H. Chan School of Public Health, 677 Huntington Ave, Kresge 505-B, Boston, MA, 02115, USA.",elm225@mail.harvard.edu.
39789615,SMAC-armed oncolytic virotherapy enhances the anticancer activity of PD1 blockade by modulating PANoptosis.,2025-Jan-09,,,
39789613,OSBPL3 modulates the immunosuppressive microenvironment and predicts therapeutic outcomes in pancreatic cancer.,2025-Jan-09,,,
39789606,Tumor metabolic regulators: key drivers of metabolic reprogramming and the promising targets in cancer therapy.,2025-Jan-09,,,
39789599,Histamine N-methyltransferase (HNMT) as a potential auxiliary biomarker for predicting adaptability to anti-HER2 drug treatment in breast cancer patients.,2025-Jan-09,Huey-En Tzeng,"Division of Hematology/Medical Oncology, Department of Medicine, Taichung Veterans General Hospital, Taichung City, Taiwan.",
39789555,Characterization and dosimetric predictors for absolute lymphocyte count changes during neoadjuvant chemoradiotherapy with or without pembrolizumab for esophageal squamous cell carcinoma: an analysis of a prospective cohort.,2025-Jan-09,,,
39789554,Effects of EGFR-TKIs combined with intracranial radiotherapy in EGFR-mutant non-small cell lung cancer patients with brain metastases: a retrospective multi-institutional analysis.,2025-Jan-09,,,
39789474,The expression of exosomal and cellular miRNAs in predicting oxaliplatin resistance in colorectal cancer cells: an in silico and in vitro study.,2025-Jan-09,,,
39789471,The burden of irritable bowel syndrome and functional dyspepsia in Poland: a cross-sectional study from West Pomeranian Voivodship.,2025-Jan-09,"Danuta Cembrowska-Lech, Konrad Podsiadło","Sanprobi sp. z o.o. sp. k, Kurza Stopka 5/c, Szczecin, 70-535, Poland., Sanprobi sp. z o.o. sp. k, Kurza Stopka 5/c, Szczecin, 70-535, Poland.",
39789445,Changes in muscle performance among older adults with myeloid malignancies engaging in a mobile health (mHealth) exercise intervention: a single arm pilot study.,2025-Jan-09,"Marielle Jensen-Battaglia, Po-Ju Lin, Chandrika Sanapala, Jason H Mendler, Jane Liesveld, Ying Wang, Elisabeth Hayward, Marissa LoCastro, Soroush Mortaz, Richard F Dunne, Karen Mustian, Kah Poh Loh","James P. Wilmot Cancer Institute, Rochester, New York, USA. marielle_jensenbattaglia@urmc.rochester.edu., James P. Wilmot Cancer Institute, Rochester, New York, USA., James P. Wilmot Cancer Institute, Rochester, New York, USA., James P. Wilmot Cancer Institute, Rochester, New York, USA., James P. Wilmot Cancer Institute, Rochester, New York, USA., James P. Wilmot Cancer Institute, Rochester, New York, USA., James P. Wilmot Cancer Institute, Rochester, New York, USA., James P. Wilmot Cancer Institute, Rochester, New York, USA., James P. Wilmot Cancer Institute, Rochester, New York, USA., James P. Wilmot Cancer Institute, Rochester, New York, USA., James P. Wilmot Cancer Institute, Rochester, New York, USA., James P. Wilmot Cancer Institute, Rochester, New York, USA. kahpoh_loh@urmc.rochester.edu.",kahpoh_loh@urmc.rochester.edu.
39789407,ANXA10 sensitizes microsatellite instability-high colorectal cancer to anti-PD-1 immunotherapy via assembly of HLA-DR dimers by regulating CD74.,2025-Jan-10,,,
39789372,"Author Correction: Paris saponin VII, a Hippo pathway activator, induces autophagy and exhibits therapeutic potential against human breast cancer cells.",2025-Jan-09,,,
39789356,Oncolytic viruses expressing MATEs facilitate target-independent T-cell activation in tumors.,2025-Jan-09,"Malin Peter, Bettina Mundt, Arne Menze, Norman Woller, Valery Volk, Amanda M Ernst, Leon A Öhler, Steven R Talbot, Heiner Wedemeyer, Christine Falk, Friedrich Feuerhake, Thomas C Wirth, Florian Kühnel","Department of Gastroenterology, Hepatology, Infectious Diseases and Endocrinology, Hannover Medical School, Hannover, Germany., Department of Gastroenterology, Hepatology, Infectious Diseases and Endocrinology, Hannover Medical School, Hannover, Germany., Department of Gastroenterology, Hepatology, Infectious Diseases and Endocrinology, Hannover Medical School, Hannover, Germany., Department of Gastroenterology, Hepatology, Infectious Diseases and Endocrinology, Hannover Medical School, Hannover, Germany., Department of Pathology, Hannover Medical School, Hannover, Germany., Department of Gastroenterology, Hepatology, Infectious Diseases and Endocrinology, Hannover Medical School, Hannover, Germany., Department of Gastroenterology, Hepatology, Infectious Diseases and Endocrinology, Hannover Medical School, Hannover, Germany., Institute for Laboratory Animal Science, Hannover Medical School, 30625, Hannover, Germany., Department of Gastroenterology, Hepatology, Infectious Diseases and Endocrinology, Hannover Medical School, Hannover, Germany., Institute of Transplantation Immunology, Hannover Medical School, Hannover, Germany., Department of Pathology, Hannover Medical School, Hannover, Germany., Department of Gastroenterology, Hepatology, Infectious Diseases and Endocrinology, Hannover Medical School, Hannover, Germany., Department of Gastroenterology, Hepatology, Infectious Diseases and Endocrinology, Hannover Medical School, Hannover, Germany. kuehnel.florian@mh-hannover.de.",kuehnel.florian@mh-hannover.de.
39789336,Platinum nanoparticles in cancer therapy: chemotherapeutic enhancement and ROS generation.,2025-Jan-09,Ikhazuagbe Hilary Ifijen,"Department of Research Outreach, Rubber Research Institute of Nigeria, PMB 1049, Benin City, Edo State, Nigeria. ifijen.hilary@rrin.gov.ng.",ifijen.hilary@rrin.gov.ng.
39789298,Assessing body awareness and upper extremity functionality in breast cancer survivors with and without lymphedema: a comparative analysis with healthy controls.,2025-Jan-10,,,
39789280,Age Matters: Early-Onset Rectal Cancer Exhibits Higher Rates of Pathological Complete Response: A Retrospective Analysis of the Influence of Young Age on Treatment Success in Stage II-III Rectal Cancer.,2025-Jan-09,"Annaclara Sileo, Richard Sassun, Jyi Cheng Ng, Sara Aboelmaaty, Ibrahim A Gomaa, Giulio Mari, Nicholas P McKenna, Kristen K Rumer, Kellie L Mathis, David W Larson","Department of Colon and Rectal Surgery, Mayo Clinic, Rochester, MN, USA., Department of Colon and Rectal Surgery, Mayo Clinic, Rochester, MN, USA., Department of Colon and Rectal Surgery, Mayo Clinic, Rochester, MN, USA., Department of Colon and Rectal Surgery, Mayo Clinic, Rochester, MN, USA., Department of Colon and Rectal Surgery, Mayo Clinic, Rochester, MN, USA., Department of Laparoscopic and Oncological General Surgery, ASST Brianza, Desio Hospital, Desio, Italy., Department of Colon and Rectal Surgery, Mayo Clinic, Rochester, MN, USA., Department of Colon and Rectal Surgery, Mayo Clinic, Rochester, MN, USA., Department of Colon and Rectal Surgery, Mayo Clinic, Rochester, MN, USA., Department of Colon and Rectal Surgery, Mayo Clinic, Rochester, MN, USA. Larson.David2@mayo.edu.",Larson.David2@mayo.edu.
39789258,Understanding the Physiopathology of Pain Pathways for a Practical Approach of Cancer Pain Management.,2025-Jan-09,"Y Bohren, M Cachemaille, I D Timbolschi, C Perruchoud","Centre d'Evaluation et Traitement de la Douleur, Hôpitaux Civils de Colmar, Colmar, France. yohann.bohren@ch-colmar.fr., Clinique de la Douleur., Hôpital de La Tour, Geneva, Suisse., Centre d'Evaluation et Traitement de la Douleur, Hôpitaux Universitaires de Strasbourg, Strasbourg, France., Clinique de la Douleur., Hôpital de La Tour, Geneva, Suisse.",yohann.bohren@ch-colmar.fr.
39789257,Ultrasound-guided Transperineal Prostate Thermal Ablation (TPTA) for Benign Prostatic Hyperplasia: Feasibility of an Outpatient Procedure using Radiofrequency Ablation.,2025-Jan-09,"Thiago Franchi Nunes, Rafael Dahmer Rocha, Bibiana Ruiz Wehling Ilgenfritz, Flávio Scavone Stefanini, Vinicius Adami Vayego Fornazari, Guilherme Cayres Mariotti, Publio Cesar Cavalcante Viana, Rodrigo Gobbo Garcia, Hugo Alexandre Socrates de Castro, Denis Szejnfeld","Department of Radiology, Universidade Federal de São Paulo (UNIFESP), Rua Dr. Ovidio Pires de Campos, 75, Cerqueira César, São Paulo, SP, 05403-010, Brazil. thiagofranchinunes@gmail.com., Instituto Dahmer Rocha, Rua Orestes Guimarães, 814, América, Joinville, SC, 89204-060, Brazil., School of Medicine, Universidade de Araraquara (UNIARA), Rua Carlos Gomes, 1338, Centro, Araraquara, SP, 14801-340, Brazil., Interventix, Rua Dr. Antônio Alves Arantes, 398, Chácara Cachoeira, Campo Grande, MS, 79040-720, Brazil., Instituto Médico RAINTER, Avenida Ibirapuera, 2907, Conjuntos 901 e 902, Moema, São Paulo, SP, 04029-200, Brazil., Hospital Israelita Albert Einstein, Avenida Albert Einstein, 627/701, MorumbiSão Paulo, SP, 05652-900, Brazil., Instituto Do Câncer Do Estado de São Paulo (ICESP), Avenida Dr. Arnaldo, 251, Cerqueira César, São Paulo, SP, 01246-000, Brazil., Hospital Israelita Albert Einstein, Avenida Albert Einstein, 627/701, MorumbiSão Paulo, SP, 05652-900, Brazil., Department of Radiology, Universidade Federal de São Paulo (UNIFESP), Rua Dr. Ovidio Pires de Campos, 75, Cerqueira César, São Paulo, SP, 05403-010, Brazil., Department of Radiology, Universidade Federal de São Paulo (UNIFESP), Rua Dr. Ovidio Pires de Campos, 75, Cerqueira César, São Paulo, SP, 05403-010, Brazil.",thiagofranchinunes@gmail.com.
39789247,A novel mitochondrial-related risk model for predicting prognosis and immune checkpoint blockade therapy response in uterine corpus endometrial carcinoma.,2025-Jan-09,Ru-Gen Liao,"Department of Obstetrics and Gynecology, The Second People's Hospital of Shantou, Shantou, 515041, Guangdong, China.",
39789208,Cancer vaccines: platforms and current progress.,2025-Jan-10,,,
39789190,EGFR-targeting RNase A-cetuximab antibody-drug conjugate induces ROS-mediated apoptosis to overcome drug resistance in KRAS mutant cancer cells.,2025-Jan-09,,,
39789183,"Severe obesity, high inflammation, insulin resistance with risks of all-cause mortality and all-site cancers, and potential modification by healthy lifestyles.",2025-Jan-09,,,
39789150,Lactylation modulation identifies key biomarkers and therapeutic targets in KMT2A-rearranged AML.,2025-Jan-09,"Dan Liu, Silu Liu, Mengjia Hou, Dongyang Li","Soochow Hopes Hematonosis Hospital, Wudong Road 1339, Wuzhong District, Suzhou, 215100, China. colleenld2020@hotmail.com., Soochow Hopes Hematonosis Hospital, Wudong Road 1339, Wuzhong District, Suzhou, 215100, China., Soochow Hopes Hematonosis Hospital, Wudong Road 1339, Wuzhong District, Suzhou, 215100, China., Soochow Hopes Hematonosis Hospital, Wudong Road 1339, Wuzhong District, Suzhou, 215100, China.",colleenld2020@hotmail.com.
39789071,"Sugemule-7 alleviates oxidative stress, neuroinflammation, and cell death, promoting synaptic plasticity recovery in mice with postpartum depression.",2025-Jan-09,"Xiyue Xiong, Yuewen Chen","NHC Key Laboratory of Birth Defect for Research and Prevention, Hunan Provincial Maternal and Child Health Care Hospital, Changsha, China., Key Laboratory of Brain Connectome and Manipulation, Shenzhen Key Laboratory of Translational Research for Brain Diseases, The Brain Cognition and Brain Disease Institute, Shenzhen Institute of Advanced Technology, Chinese Academy of Sciences, Chinese Academy of Sciences, Hong Kong Institute of Brain Science-Shenzhen Fundamental Research Institutions, Shenzhen, 518055, Guangdong, China. yw.chen1@siat.ac.cn.",yw.chen1@siat.ac.cn.
39789066,Y,2025-Jan-09,,,
39789065,High Ano1 expression as key driver of resistance to radiation and cisplatin in HPV-negative head and neck squamous cell carcinoma.,2025-Jan-10,"Solenne Bourdier, Anne-Sophie Fisch, Keziban Merve Alp, Ridhima Das, Philipp Mertins, Ingeborg Tinhofer","Department of Radiooncology and Radiotherapy, Charité - Universitätsmedizin Berlin, Corporate Member of Freie Universität Berlin and Humboldt-Universität zu Berlin, Charitéplatz 1, 10117, Berlin, Germany., Department of Radiooncology and Radiotherapy, Charité - Universitätsmedizin Berlin, Corporate Member of Freie Universität Berlin and Humboldt-Universität zu Berlin, Charitéplatz 1, 10117, Berlin, Germany., Max Delbrück Center for Molecular Medicine, Robert-Rössle-Str. 10, 13092, Berlin, Germany., Department of Radiooncology and Radiotherapy, Charité - Universitätsmedizin Berlin, Corporate Member of Freie Universität Berlin and Humboldt-Universität zu Berlin, Charitéplatz 1, 10117, Berlin, Germany., Max Delbrück Center for Molecular Medicine, Robert-Rössle-Str. 10, 13092, Berlin, Germany., Department of Radiooncology and Radiotherapy, Charité - Universitätsmedizin Berlin, Corporate Member of Freie Universität Berlin and Humboldt-Universität zu Berlin, Charitéplatz 1, 10117, Berlin, Germany. ingeborg.tinhofer@charite.de.",ingeborg.tinhofer@charite.de.
39789010,Alleviation of liver fibrosis by inhibiting a non-canonical ATF4-regulated enhancer program in hepatic stellate cells.,2025-Jan-09,,,
39788975,Network-based transfer of pan-cancer immunotherapy responses to guide breast cancer prognosis.,2025-Jan-10,,,
39788967,Neoadjuvant or concurrent atezolizumab with chemoradiation for locally advanced cervical cancer: a randomized phase I trial.,2025-Jan-09,"Dmitriy Zamarin, Wei Deng, Heather A Lankes, Giulio Pesci, Hayeon Kim, Barbara Banbury, Ned Sherry, Elad Sharon, Cara Mathews, Roisin O'Cearbhaill, Carol Aghajanian","Icahn School of Medicine at Mount Sinai, New York City, USA., NRG Oncology Statistics & Data Center, Buffalo, USA., NRG OncologyOperations Center-Philadelphia East, Philadelphia, USA., Memorial Sloan-Kettering Cancer Center, New York City, USA., UPMC Hillman Cancer Center, Pittsburgh, USA., Adaptive Biotechnologies Corp, Seattle, USA., Adaptive Biotechnologies Corp, Seattle, USA., Dana Faber Cancer Institute, Boston, USA., Women & Infants Hospital, Providence, USA., Memorial Sloan-Kettering Cancer Center, New York City, USA., Memorial Sloan-Kettering Cancer Center, New York City, USA.",
39788945,Enhancing immunotherapy efficacy in colorectal cancer: targeting the FGR-AKT-SP1-DKK1 axis with DCC-2036 (Rebastinib).,2025-Jan-09,"Qiting Zeng, Bingru Yan","The First Affiliated Hospital, Department of Clinical Laboratory Medicine, Hengyang, Hunan, 421001, PR China., Central Hospital of Hengyang City, Oncology Department, Hengyang, Hunan, 421001, PR China.",
39788939,CDK4 inactivation inhibits apoptosis via mitochondria-ER contact remodeling in triple-negative breast cancer.,2025-Jan-09,"Marie-Agnès Berger, Yves Gouriou, George Sflomos, Carlos Ronchi, Cathrin Brisken, Jennifer Rieusset","Laboratoire CarMeN, UMR INSERM U1060/INRA U1397, Université Claude Bernard Lyon1, F-69310, Pierre-Bénite, France., Laboratoire CarMeN, UMR INSERM U1060/INRA U1397, Université Claude Bernard Lyon1, F-69310, Pierre-Bénite, France., ISREC-Swiss Institute for Experimental Cancer Research, School of Life Sciences, Ecole Polytechnique Fédérale de Lausanne (EPFL), Lausanne, Switzerland., ISREC-Swiss Institute for Experimental Cancer Research, School of Life Sciences, Ecole Polytechnique Fédérale de Lausanne (EPFL), Lausanne, Switzerland., ISREC-Swiss Institute for Experimental Cancer Research, School of Life Sciences, Ecole Polytechnique Fédérale de Lausanne (EPFL), Lausanne, Switzerland., Laboratoire CarMeN, UMR INSERM U1060/INRA U1397, Université Claude Bernard Lyon1, F-69310, Pierre-Bénite, France.",
39788918,Feasibility study of patient-specific four-dimensional in vivo tracking system for high-dose-rate brachytherapy: Experimental evaluation.,2025-Jan-09,"Dong-Seok Shin, Jaehyeon Seo, Dongho Shin","Proton Therapy Center, National Cancer Center, Goyang, Republic of Korea., Environmental Radioactivity Assessment Team, Korea Atomic Energy Research Institute, Daejeon, Republic of Korea., Proton Therapy Center, National Cancer Center, Goyang, Republic of Korea.",
39788912,Major ABO Incompatibility in Non-Myeloablative Hematopoietic Stem Cell Transplant for Sickle Cell Disease-Not an Insurmountable Obstacle.,2025-Jan-09,"Kimberly Ji Eun Chung, Donna A Wall, Kuang-Yueh Chiang","Blood and Marrow Transplant/Cellular Therapy Program, Division of Hematology/Oncology, The Hospital for Sick Children, Toronto, Ontario, Canada., Blood and Marrow Transplant/Cellular Therapy Program, Division of Hematology/Oncology, The Hospital for Sick Children, Toronto, Ontario, Canada., Blood and Marrow Transplant/Cellular Therapy Program, Division of Hematology/Oncology, The Hospital for Sick Children, Toronto, Ontario, Canada.",
39788889,Neoadjuvant Concurrent Chemoradiation and Esophagectomy for Esophageal Cancer: Outcomes With New-Onset Atrial Fibrillation.,2025-Jan,,,
39788886,Dendrimer-Mediated Generation of a Metal-Phenolic Network for Antibody Delivery to Elicit Improved Tumor Chemo/Chemodynamic/Immune Therapy.,2025-Jan-09,,,
39788877,Nursing practices for a patient with ALK-negative anaplastic large cell lymphoma with a cancerous wound: a case report.,2024-Dec,,,
39788823,Concomitant antihistamine administration is associated with improved survival outcomes in patients with locally advanced or metastatic urothelial carcinoma treated with atezolizumab. Analysis of individual participant data from IMvigor210 and IMvigor211.,2025-Jan-08,"Giuseppe Fallara, Bernard Malavaud","Department of Urology, IRCCS European Institute of Oncology, Milan, Italy., Department of Urology, Institut Universitaire du Cancer Toulouse - Oncopôle, Toulouse, France.",
39788816,Development and Evaluation of a Remote Monitoring Regional Adjuvant Abemaciclib Service for Patients With High-Risk Early Breast Cancer.,2024-Dec-07,"Nicole L Brown, Suzanne Frank, Siow Chin Phua, Jack E Johnson, Anne Armstrong, Caroline Wilson, Sophie Raby, Yvonne Hulmes, Fiona Britton","Department of Medical Oncology, The Christie NHS Foundation Trust, Manchester, UK., Department of Pharmacy, The Christie NHS Foundation Trust, Manchester, UK., Department of Pharmacy, The Christie NHS Foundation Trust, Manchester, UK., Department of Pharmacy, The Christie NHS Foundation Trust, Manchester, UK., Department of Medical Oncology, The Christie NHS Foundation Trust, Manchester, UK., Department of Medical Oncology, The Christie NHS Foundation Trust, Manchester, UK., Department of Medical Oncology, The Christie NHS Foundation Trust, Manchester, UK., Department of Medical Oncology, The Christie NHS Foundation Trust, Manchester, UK., Department of Medical Oncology, The Christie NHS Foundation Trust, Manchester, UK.",
39788744,Advanced-stage duodenal cancer in pregnancy.,2025-Jan-09,,,
39788650,Single cell combined with laser ablation ICP-MS to study cisplatinum (IV) loaded nanoparticles penetration pathways in osteosarcoma spheroids.,2025-Jan-22,,,
39788584,[Consensus on the management of liver injury associated with targeted drugs and immune checkpoint inhibitors for hepatocellular carcinoma ( version 2024)].,2024-Dec-20,,,
39788569,Iron-Based Nanomaterials for Modulating Tumor Microenvironment.,2025,"Xiaoting Zhang, Lulu He, Yujie Zhang, Aiguo Wu, Juan Li","Laboratory of Advanced Theranostic Materials and Technology, Ningbo Institute of Materials Technology and Engineering, Chinese Academy of Sciences, Ningbo, China., Laboratory of Advanced Theranostic Materials and Technology, Ningbo Institute of Materials Technology and Engineering, Chinese Academy of Sciences, Ningbo, China., Laboratory of Advanced Theranostic Materials and Technology, Ningbo Institute of Materials Technology and Engineering, Chinese Academy of Sciences, Ningbo, China., Laboratory of Advanced Theranostic Materials and Technology, Ningbo Institute of Materials Technology and Engineering, Chinese Academy of Sciences, Ningbo, China., Laboratory of Advanced Theranostic Materials and Technology, Ningbo Institute of Materials Technology and Engineering, Chinese Academy of Sciences, Ningbo, China.",
39788567,"A Novel Microbe, Immunization Deaths, and Vaccination on Trial: BCG and the Lübeck Disaster of 1930.",2025-Jan-09,,,
39788558,Computational pathology applied to clinical colorectal cancer cohorts identifies immune and endothelial cell spatial patterns predictive of outcome.,2025-Feb,"Nicholas Trahearn, Chirine Sakr, Seung Hyun Lee, Ann-Marie Baker, Federica Morano, Francesca Bergamo, Giulia Maddalena, Rossana Intini, Chiara Cremolini, Trevor Graham, Filippo Pietrantonio, Sara Lonardi, Andrea Sottoriva","Centre for Evolution and Cancer, The Institute of Cancer Research, London, UK., Centre for Evolution and Cancer, The Institute of Cancer Research, London, UK., Centre for Evolution and Cancer, The Institute of Cancer Research, London, UK., Centre for Evolution and Cancer, The Institute of Cancer Research, London, UK., Fondazione IRCCS Istituto Nazionale dei Tumori, Milan, Italy., Veneto Institute of Oncology IOV-IRCCS, Padua, Italy., Veneto Institute of Oncology IOV-IRCCS, Padua, Italy., Veneto Institute of Oncology IOV-IRCCS, Padua, Italy., Computational Biology Research Centre, Human Technopole, Milan, Italy., Centre for Evolution and Cancer, The Institute of Cancer Research, London, UK., Fondazione IRCCS Istituto Nazionale dei Tumori, Milan, Italy., Veneto Institute of Oncology IOV-IRCCS, Padua, Italy., Centre for Evolution and Cancer, The Institute of Cancer Research, London, UK.",
39788520,Application of tumor organoids simulating the tumor microenvironment in basic and clinical research of tumor immunotherapy.,2024-Aug-28,,,
39788504,Alectinib treatment for 2 non-small cell lung carcinoma patients carrying different novel ,2024-Jul-28,,,
39788501,Effects of a 4,2024-Jul-28,,,
39788500,Efficacy of ,2024-Jul-28,,,
39788496,Hypophysitis associated with immune check piont inhibitors treatment: A case report and literature review.,2024-Jul-28,"Jie Wei, Xingxing Han, Yutong Ye, Tiantian Qi, Tianyan Zhou, Feng Lu, Xinlin Yan","Department of Endocrinology, Kunshan Integrated Traditional and Western Medicine Hospital, Suzhou Jiangsu 215000. 1105582277@qq.com., Department of Endocrinology, Kunshan Integrated Traditional and Western Medicine Hospital, Suzhou Jiangsu 215000., Department of Endocrinology, Kunshan Integrated Traditional and Western Medicine Hospital, Suzhou Jiangsu 215000., Department of Endocrinology, Kunshan Integrated Traditional and Western Medicine Hospital, Suzhou Jiangsu 215000., Department of Endocrinology, Kunshan Integrated Traditional and Western Medicine Hospital, Suzhou Jiangsu 215000., Department of Endocrinology, Kunshan Integrated Traditional and Western Medicine Hospital, Suzhou Jiangsu 215000., Department of Endocrinology, Kunshan Integrated Traditional and Western Medicine Hospital, Suzhou Jiangsu 215000. 734155278@qq.com.",734155278@qq.com.
39788485,P-Glycoprotein Drives Glioblastoma Survival and Chemotherapy Resistance: Potential as a Promising Liquid Biopsy Biomarker.,2025-Jan-06,"Carlos Pilotto Heming, Isabel de Souza Barbosa, Renan Lyra Miranda, Odile Nogueira Ugarte, Vitória Santório de São José, Vivaldo Moura-Neto, Veronica Aran","Programa de Pós-Graduação em Anatomia Patológica, Faculdade de Medicina, Universidade Federal do Rio de Janeiro (UFRJ), Rio de Janeiro, Brazil; Instituto Estadual do Cérebro Paulo Niemeyer (IECPN), Rio de Janeiro, Brazil., Programa de Pós-Graduação em Anatomia Patológica, Faculdade de Medicina, Universidade Federal do Rio de Janeiro (UFRJ), Rio de Janeiro, Brazil; Instituto Estadual do Cérebro Paulo Niemeyer (IECPN), Rio de Janeiro, Brazil., Instituto Estadual do Cérebro Paulo Niemeyer (IECPN), Rio de Janeiro, Brazil., Instituto Estadual do Cérebro Paulo Niemeyer (IECPN), Rio de Janeiro, Brazil., Instituto Estadual do Cérebro Paulo Niemeyer (IECPN), Rio de Janeiro, Brazil., Instituto Estadual do Cérebro Paulo Niemeyer (IECPN), Rio de Janeiro, Brazil., Programa de Pós-Graduação em Anatomia Patológica, Faculdade de Medicina, Universidade Federal do Rio de Janeiro (UFRJ), Rio de Janeiro, Brazil; Instituto Estadual do Cérebro Paulo Niemeyer (IECPN), Rio de Janeiro, Brazil. Electronic address: varanponte@gmail.com.",varanponte@gmail.com.
39788431,Spliced exon9 ADRM1 promotes liver oncogenicity via selective degradation of tumor suppressor FBXW7.,2025-Jan-07,,,
