PubmedID,Title,Publication Date,Non-academic Author(s),Company Affiliation(s),Corresponding Author Email
39780285,ONC213: a novel strategy to resensitize resistant AML cells to venetoclax through induction of mitochondrial stress.,2025-Jan-09,"Eman T Al-Antary, Steven A Buck, Joshua E Allen, Varun V Prabhu","Division of Pediatric Hematology/Oncology, Children's Hospital of Michigan, Detroit, MI, 48201, USA., Division of Pediatric Hematology/Oncology, Children's Hospital of Michigan, Detroit, MI, 48201, USA., Chimerix, Inc, Durham, NC, 27713, USA., Chimerix, Inc, Durham, NC, 27713, USA.",
39780280,Safety and efficacy of immune checkpoint inhibitors in patients with pre-treatment reduced left ventricular function.,2025-Jan-08,"Maor Tzuberi, Rafael Y Brzezinski, Nir Flint, Moaad Slieman, Lior Zornitzki, Dana Viskin, Anna Rozenfeld Hemed, Barliz Waissengrin, Renana Barak, Inbal Golomb, Ido Wolf, Netanel Golan, Yan Topilsky, Shmuel Banai, Livia Kapusta, Michal Laufer-Perl","Division of Cardiology, Tel Aviv Sourasky medical Center, Tel Aviv, Israel., Division of Cardiology, Tel Aviv Sourasky medical Center, Tel Aviv, Israel., Division of Cardiology, Tel Aviv Sourasky medical Center, Tel Aviv, Israel., Division of Cardiology, Tel Aviv Sourasky medical Center, Tel Aviv, Israel., Division of Cardiology, Tel Aviv Sourasky medical Center, Tel Aviv, Israel., Division of Cardiology, Tel Aviv Sourasky medical Center, Tel Aviv, Israel., Division of Cardiology, Tel Aviv Sourasky medical Center, Tel Aviv, Israel., Division of Oncology, Tel Aviv Sourasky Medical Center, Tel Aviv, Israel., Division of Oncology, Tel Aviv Sourasky Medical Center, Tel Aviv, Israel., Division of Oncology, Tel Aviv Sourasky Medical Center, Tel Aviv, Israel., Division of Oncology, Tel Aviv Sourasky Medical Center, Tel Aviv, Israel., Division of Cardiology, Tel Aviv Sourasky medical Center, Tel Aviv, Israel., Division of Cardiology, Tel Aviv Sourasky medical Center, Tel Aviv, Israel., Division of Cardiology, Tel Aviv Sourasky medical Center, Tel Aviv, Israel., Pediatric Cardiology Unit, Tel-Aviv Sourasky Medical Center, Tel Aviv, Israel., Division of Cardiology, Tel Aviv Sourasky medical Center, Tel Aviv, Israel. michalpela@gmail.com.",michalpela@gmail.com.
39780278,The role of endothelial cell-related gene COL1A1 in prostate cancer diagnosis and immunotherapy: insights from machine learning and single-cell analysis.,2025-Jan-08,,,
39780269,Fecal microbiota transplantation attenuates Alzheimer's disease symptoms in APP/PS1 transgenic mice via inhibition of the TLR4-MyD88-NF-κB signaling pathway-mediated inflammation.,2025-Jan-08,,,
39780248,Myeloid-derived suppressor cells (MDSCs) in the tumor microenvironment and their targeting in cancer therapy.,2025-Jan-08,,,
39780232,Modulating tumor-associated macrophages through CSF1R inhibition: a potential therapeutic strategy for HNSCC.,2025-Jan-08,,,
39780231,Pharmacological Vitamin C-induced high H,2025-Jan-08,"Ali Mussa, Ahmad Hafiz Murtadha, Noor Fatmawati Mokhtar, Vuk Uskoković, Rohimah Mohamud, Rosline Hassan","Department of Haematology, School of Medical Sciences, Universiti Sains Malaysia, Kubang Kerian, 16150, Kelantan, Malaysia., Institute for Research in Molecular Medicine (INFORMM), Universiti Sains Malaysia, Health Campus, Kubang Kerian, 16150, Kelantan, Malaysia., Institute for Research in Molecular Medicine (INFORMM), Universiti Sains Malaysia, Health Campus, Kubang Kerian, 16150, Kelantan, Malaysia., Advanced Materials and Nanobiotechnology Laboratory, TardigradeNano LLC, Irvine, CA, 92604, USA., Department of Immunology, School of Medical Sciences, Universiti Sains Malaysia, Kubang Kerian, 16150, Kelantan, Malaysia. rohimahm@usm.my., Department of Haematology, School of Medical Sciences, Universiti Sains Malaysia, Kubang Kerian, 16150, Kelantan, Malaysia. roslin@usm.my.",roslin@usm.my.
39780187,"Cancer-associated fibroblasts as therapeutic targets for cancer: advances, challenges, and future prospects.",2025-Jan-09,"Zhipeng Cao, Sadia Quazi, Sakshi Arora, Laura D Osellame, Ingrid J Burvenich, Peter W Janes, Andrew M Scott","Tumour Targeting Laboratory, Olivia Newton-John Cancer Research Institute, Melbourne, VIC, 3084, Australia. Zhipeng.Cao@onjcri.org.au., Tumour Targeting Laboratory, Olivia Newton-John Cancer Research Institute, Melbourne, VIC, 3084, Australia., Tumour Targeting Laboratory, Olivia Newton-John Cancer Research Institute, Melbourne, VIC, 3084, Australia., Tumour Targeting Laboratory, Olivia Newton-John Cancer Research Institute, Melbourne, VIC, 3084, Australia., Tumour Targeting Laboratory, Olivia Newton-John Cancer Research Institute, Melbourne, VIC, 3084, Australia., Tumour Targeting Laboratory, Olivia Newton-John Cancer Research Institute, Melbourne, VIC, 3084, Australia., Tumour Targeting Laboratory, Olivia Newton-John Cancer Research Institute, Melbourne, VIC, 3084, Australia. Andrew.Scott@onjcri.org.au.",Andrew.Scott@onjcri.org.au.
39780157,Potentially actionable molecular alterations in particular related to poor oncologic outcomes in salivary gland carcinomas.,2025-Jan-08,,,
39780146,Investigation of the causal relationship between patient portal utilization and patient's self-care self-efficacy and satisfaction in care among patients with cancer.,2025-Jan-08,,,
39780142,Development of a prognostic nomogram and risk stratification system for elderly patients with esophageal squamous cell carcinoma undergoing definitive radiotherapy: a multicenter retrospective analysis (3JECROG R-03 A).,2025-Jan-08,"Chuyan Lin, Yidian Zhao, Gaofeng Li, Kaixian Zhang, Ling Li","Interventional Ward, Department of Radiology, 900 Hospital of the Joint Logistics Team, 156 North Xi-er Huan Road, Fuzhou City, Fujian Province, People's Republic of China., Department 4th of Radiation Oncology, Anyang Cancer Hospital, Anyang, 455000, China., Department of Radiation Oncology, Beijing Hospital, National Center of Gerontology, Beijing, 100730, China., Department of Oncology, Tengzhou Central People's Hospital, Tengzhou, 277599, China., Department of Oncology, Tengzhou Central People's Hospital, Tengzhou, 277599, China.",
39780133,"Effect of different protocols in preventing demineralization in irradiated human enamel, in vitro study.",2025-Jan-08,"Chawalid Pianmee, Chalermchart Bunsong","Clinic of Excellence for Pediatric Dentistry and Special Care Need, Dental Center, Surin Hospital, Surin, Thailand., Department of Radiation Oncology, Chonburi Cancer Hospital, Chonburi, Thailand.",
39780129,Astaxanthin-loaded PLGA nanoparticles inhibit survival of MKN-45 gastric cancer cell line by modulating JAK2/STAT3/mTOR/PI3K pathway.,2025-Jan-09,Masoud Hamidi,"Université libre de Bruxelles (ULB), École polytechnique de Bruxelles - 3BIO-BioMatter, Avenue F.D. Roosevelt, 50 - CP 165/61, Brussels, 1050, Belgium.",
39780119,Carboplatin in combination with etoposide for advanced small cell lung cancer complicated with idiopathic interstitial pneumonia: a single-arm phase II study.,2025-Jan-08,"Masaru Matsumoto, Yuji Minegishi, Katsuyuki Higa, Aya Fukuizumi, Naomi Onda, Susumu Takeuchi, Akihiko Miyanaga, Akihiko Gemma, Masahiro Seike","Department of Pulmonary Medicine and Oncology, Graduate School of Medicine, Nippon Medical School, 1-1-5 Sendagi, Bunkyo-ku, Tokyo, 113-8603, Japan. s7062@nms.ac.jp., Department of Respiratory Medicine, Mitsui Memorial Hospital, Tokyo, Japan., Department of Pulmonary Medicine and Oncology, Graduate School of Medicine, Nippon Medical School, 1-1-5 Sendagi, Bunkyo-ku, Tokyo, 113-8603, Japan., Department of Pulmonary Medicine and Oncology, Graduate School of Medicine, Nippon Medical School, 1-1-5 Sendagi, Bunkyo-ku, Tokyo, 113-8603, Japan., Department of Pulmonary Medicine and Oncology, Graduate School of Medicine, Nippon Medical School, 1-1-5 Sendagi, Bunkyo-ku, Tokyo, 113-8603, Japan., Department of Pulmonary Medicine and Oncology, Graduate School of Medicine, Nippon Medical School, 1-1-5 Sendagi, Bunkyo-ku, Tokyo, 113-8603, Japan., Department of Pulmonary Medicine and Oncology, Graduate School of Medicine, Nippon Medical School, 1-1-5 Sendagi, Bunkyo-ku, Tokyo, 113-8603, Japan., Department of Pulmonary Medicine and Oncology, Graduate School of Medicine, Nippon Medical School, 1-1-5 Sendagi, Bunkyo-ku, Tokyo, 113-8603, Japan., Department of Pulmonary Medicine and Oncology, Graduate School of Medicine, Nippon Medical School, 1-1-5 Sendagi, Bunkyo-ku, Tokyo, 113-8603, Japan.",s7062@nms.ac.jp.
39780104,Cross-cultural adaptation of the simple Chinese version of the medication adherence reasons scale in patients undergoing adjuvant endocrine therapy for breast cancer.,2025-Jan-08,Chunyang Lu,"Breast Surgery Department, Hangzhou Institute of Medicine, Zhejiang Cancer Hospital, Chinese Academy of Sciences, Hangzhou, Zhejiang, China.",
39780102,Impact of irradiation conditions on therapy of Lewis lung carcinoma in mice using glucose-ethylenediamine carbon dots.,2025-Jan-08,"Mykola Isaiev, Nataliya Pozdnyakova, Artem Pastukhov, Nataliya Krisanova","Université de Lorraine, CNRS, LEMTA, Nancy, F-54000, France., Palladin Institute of Biochemistry, National Academy of Sciences of Ukraine, 9 Leontovicha Street, Kiev, 01054, Ukraine., Palladin Institute of Biochemistry, National Academy of Sciences of Ukraine, 9 Leontovicha Street, Kiev, 01054, Ukraine., Palladin Institute of Biochemistry, National Academy of Sciences of Ukraine, 9 Leontovicha Street, Kiev, 01054, Ukraine.",
39780099,Triple-drug antibiotic therapy for disseminated nocardial abscess in the mediastinum and brain of an immunocompetent patient: a case report.,2025-Jan-08,"Yue Zhang, Zhongchun Qi, Hua Li, Hui Gao","Department of Oncology, General Hospital of Western Theatre Command, No. 270, Tianhui Road, Rongdu Avenue, Jinniu District, Chengdu, Sichuan, 610000, People's Republic of China., Department of Oncology, General Hospital of Western Theatre Command, No. 270, Tianhui Road, Rongdu Avenue, Jinniu District, Chengdu, Sichuan, 610000, People's Republic of China., Department of Oncology, General Hospital of Western Theatre Command, No. 270, Tianhui Road, Rongdu Avenue, Jinniu District, Chengdu, Sichuan, 610000, People's Republic of China., Department of Oncology, General Hospital of Western Theatre Command, No. 270, Tianhui Road, Rongdu Avenue, Jinniu District, Chengdu, Sichuan, 610000, People's Republic of China. gaoh_rad@foxmail.com.",gaoh_rad@foxmail.com.
39780089,"Ultrasound localization microscopy in the diagnosis of breast tumors and prediction of relevant histologic biomarkers associated with prognosis in humans: the protocol for a prospective, multicenter study.",2025-Jan-08,,,
39780067,"Postdiagnostic use of antihypertensive medications and survival in colorectal, lung, corpus uteri, melanoma and kidney cancer patients with hypertension.",2025-Jan-08,"Rūta Everatt, Irena Kuzmickienė, Birutė Brasiūnienė, Ieva Vincerževskienė, Birutė Intaitė, Saulius Cicėnas","Laboratory of Cancer Epidemiology, National Cancer Institute, Baublio 3B, Vilnius, LT-08406, Lithuania. ruta.everatt@nvi.lt., Laboratory of Cancer Epidemiology, National Cancer Institute, Baublio 3B, Vilnius, LT-08406, Lithuania., Department of Medical Oncology, National Cancer Institute, Vilnius, Lithuania., Laboratory of Clinical Oncology, National Cancer Institute, Vilnius, Lithuania., Department of Gynaecologic Oncology, National Cancer Institute, Vilnius, Lithuania., Department of Thoracic Surgery and Oncology, National Cancer Institute, Vilnius, Lithuania.",ruta.everatt@nvi.lt.
39780053,"Comparative study between high and low dose methylene blue infusion in septic cancer patients: a randomized, blinded, controlled study.",2025-Jan-08,,,
39780051,The microbiota-derived bile acid taurodeoxycholic acid improves hepatic cholesterol levels in mice with cancer cachexia.,2025-Dec,"Morgane M Thibaut, Martin Roumain, Edwige Piron, Justine Gillard, Axelle Loriot, Audrey M Neyrinck, Julie Rodriguez, Isabelle Massart, Jean-Paul Thissen, Nathalie M Delzenne, Giulio G Muccioli, Laure B Bindels","Metabolism and Nutrition Research Group, Louvain Drug Research Institute, UCLouvain, Université catholique de Louvain, Brussels, Belgium., Metabolism and Nutrition Research Group, Louvain Drug Research Institute, UCLouvain, Université catholique de Louvain, Brussels, Belgium., Metabolism and Nutrition Research Group, Louvain Drug Research Institute, UCLouvain, Université catholique de Louvain, Brussels, Belgium., Metabolism and Nutrition Research Group, Louvain Drug Research Institute, UCLouvain, Université catholique de Louvain, Brussels, Belgium., Computational Biology and Bioinformatics Unit (CBIO), de Duve Institute, UCLouvain, Université catholique de Louvain, Brussels, Belgium., Metabolism and Nutrition Research Group, Louvain Drug Research Institute, UCLouvain, Université catholique de Louvain, Brussels, Belgium., Metabolism and Nutrition Research Group, Louvain Drug Research Institute, UCLouvain, Université catholique de Louvain, Brussels, Belgium., Endocrinology, Diabetology and Nutrition Department, Institut de Recherches Expérimentales et Cliniques, UCLouvain, Université catholique de Louvain, Cliniques Universitaires Saint-Luc, Brussels, Belgium., Endocrinology, Diabetology and Nutrition Department, Institut de Recherches Expérimentales et Cliniques, UCLouvain, Université catholique de Louvain, Cliniques Universitaires Saint-Luc, Brussels, Belgium., Metabolism and Nutrition Research Group, Louvain Drug Research Institute, UCLouvain, Université catholique de Louvain, Brussels, Belgium., Bioanalysis and Pharmacology of Bioactive Lipids Research Group, Louvain Drug Research Institute, UCLouvain, Université catholique de Louvain, Brussels, Belgium., Metabolism and Nutrition Research Group, Louvain Drug Research Institute, UCLouvain, Université catholique de Louvain, Brussels, Belgium.",
39780006,Reinventing type 2 immunity in cancer.,2025-Jan,"Marek Wagner, Shigeo Koyasu","Innate Immunity Research Group, Life Sciences and Biotechnology Center, Łukasiewicz Research Network-PORT Polish Center for Technology Development, Wrocław, Poland. marek.wagner@port.lukasiewicz.gov.pl., Laboratory for Immune Cell Systems, RIKEN Center for Integrative Medical Sciences, Yokohama, Japan. shigeo.koyasu@riken.jp.",shigeo.koyasu@riken.jp.
39779996,Gene signatures derived from transcriptomic-causal networks stratify colorectal cancer patients for effective targeted therapy.,2025-Jan-08,"Heinz-Josef Lenz, Raul Mendez-Giraldez, Azam Yazdani, Esmat Samiei, Xueping Qu, Yujia Wen, Monica M Bertagnolli","USC Norris Comprehensive Cancer Center, Los Angeles, CA, USA., Biostatistics and Computational Biology Branch, National Institute of Environmental Health Sciences, Durham, NC, USA., Center of Perioperative Genetics and Genomics, Perioperative and Pain Medicine, Brigham & Women's Hospital, Harvard Medical School, Boston, MA, USA., Gamelectronic, Tehran, Iran., Genentech, South San Francisco, San Francisco, CA, USA., Alliance for Clinical Trials in Oncology, Chicago, IL, USA., Dana-Farber/ Partners Cancer Care, Harvard Medical School, Boston, MA, USA.",
39779964,Evaluation of clinical risk stratification to determine benefit from long-term versus short-term androgen deprivation in high-risk localized prostate cancer.,2025-Jan-08,"Praful Ravi, Wanling Xie, Silke Gillessen, Bertrand Tombal, Paul L Nguyen","Dana-Farber Cancer Institute, Boston, MA, USA. praful_ravi@dfci.harvard.edu., Dana-Farber Cancer Institute, Boston, MA, USA., Oncology Institute of Southern Switzerland, EOC, Bellinzona, Switzerland., Cliniques Universitaires Saint-Luc, Brussels, Belgium., Brigham & Women's Hospital, Boston, MA, USA.",praful_ravi@dfci.harvard.edu.
39779950,"Management, biomarkers and prognosis in people developing endocrinopathies associated with immune checkpoint inhibitors.",2025-Jan-09,,,
39779930,T cell malignancies after CAR T cell therapy in the DESCAR-T registry.,2025-Jan-08,"Emmanuel Bachy, Jacques-Olivier Bay","Hematology Department, Hospices Civils de Lyon, Pierre-Bénite, France., Department of Adult Clinical Hematology and Cellular Therapy, CHU Clermont-Ferrand, Clermont-Ferrand, France.",
39779851,A vision-language foundation model for precision oncology.,2025-Jan-08,Kun-Hsing Yu,"Department of Biomedical Informatics, Harvard Medical School, Boston, MA, USA.",
39779812,The non-nutritive sweetener rebaudioside a enhances phage infectivity.,2025-Jan-08,"Ewa Brzozowska, Jan Brykała, Bożena Szermer-Olearnik","Department of Immunology of Infectious Diseases, Hirszfeld Institute of Immunology and Experimental Therapy, Polish Academy of Sciences, 12 R. Weigl St, Wroclaw, 53114, Poland., Department of Immunology of Infectious Diseases, Hirszfeld Institute of Immunology and Experimental Therapy, Polish Academy of Sciences, 12 R. Weigl St, Wroclaw, 53114, Poland., Department of Experimental Oncology, Hirszfeld Institute of Immunology and Experimental Therapy, Polish Academy of Sciences, 12 R. Weigl St, Wroclaw, 53114, Poland.",
39779797,Quality of life in early breast cancer patients after adjuvant accelerated partial-breast irradiation (APBI) in randomized trial.,2025-Jan-09,"Petr Burkon, Iveta Selingerova, Miroslav Vrzal, Milos Holanek, Oldrich Coufal, Katerina Polachova, Vera Andraskova, Pavel Slampa, Tomas Kazda, Marek Slavik","Department of Radiation Oncology, Masaryk Memorial Cancer Institute, Zluty kopec 7, Brno, 656 53, Czech Republic., Research Centre for Applied Molecular Oncology (RECAMO), Masaryk Memorial Cancer Institute, Zluty kopec 7, Brno, 656 53, Czech Republic. iveta.selingerova@mou.cz., Department of Radiation Oncology, Masaryk Memorial Cancer Institute, Zluty kopec 7, Brno, 656 53, Czech Republic., Department of Comprehensive Cancer Care, Masaryk Memorial Cancer Institute, Brno, Czech Republic., Department of Surgical Oncology, Masaryk Memorial Cancer Institute, Brno, Czech Republic., Department of Radiation Oncology, Masaryk Memorial Cancer Institute, Zluty kopec 7, Brno, 656 53, Czech Republic., Clinical Nutrition Unit, Masaryk Memorial Cancer Institute, Brno, Czech Republic., Department of Radiation Oncology, Masaryk Memorial Cancer Institute, Zluty kopec 7, Brno, 656 53, Czech Republic., Department of Radiation Oncology, Masaryk Memorial Cancer Institute, Zluty kopec 7, Brno, 656 53, Czech Republic., Department of Radiation Oncology, Masaryk Memorial Cancer Institute, Zluty kopec 7, Brno, 656 53, Czech Republic. marek.slavik@mou.cz.",marek.slavik@mou.cz.
39779772,Boosting skin cancer diagnosis accuracy with ensemble approach.,2025-Jan-08,"Priya Natha, Sivarama Prasad Tera, Ravikumar Chinthaginjala, C Venkata Narasimhulu","Department of Computer Science and Engineering, Koneru Lakshmaiah Education Foundation, Green Fields, Vaddeswaram, Guntur, Andhra Pradesh, 522302, India., Department of Electronics and Electrical Engineering, Indian Institute of Technology, Guwahati, Assam, 781039, India., School of Electronics Engineering, Vellore Institute of Technology, Vellore, Tamil Nadu, 632014, India. cvrkvit@gmail.com., Department of Electronics and Communication Engineering, Chaitanya Bharati Institute of Technology, Hyderabad, 500075, India.",cvrkvit@gmail.com.
39779746,Identifying ADME-related gene signature for immune landscape and prognosis in KIRC by single-cell and spatial transcriptome analysis.,2025-Jan-08,,,
39779693,Pan-inhibition of super-enhancer-driven oncogenic transcription by next-generation synthetic ecteinascidins yields potent anti-cancer activity.,2025-Jan-08,"Max Cigrang, Julian Obid, Maguelone Nogaret, Léane Seno, Tao Ye, Guillaume Davidson, Philippe Catez, Pietro Berico, Clara Capelli, Clara Marechal, Amélie Zachayus, Clémence Elly, Marie Jose Guillen Navarro, Marta Martinez Diez, Gema Santamaria Nunez, Emmanuel Compe, Pablo Avilés, Irwin Davidson, Jean-Marc Egly, Carmen Cuevas, Frédéric Coin","IGBMC, Institut de Génétique et de Biologie Moléculaire et Cellulaire Illkirch Cedex, C.U. Equipe Labélisée Ligue contre le Cancer, Strasbourg, France., IGBMC, Institut de Génétique et de Biologie Moléculaire et Cellulaire Illkirch Cedex, C.U. Equipe Labélisée Ligue contre le Cancer, Strasbourg, France., IGBMC, Institut de Génétique et de Biologie Moléculaire et Cellulaire Illkirch Cedex, C.U. Equipe Labélisée Ligue contre le Cancer, Strasbourg, France., IGBMC, Institut de Génétique et de Biologie Moléculaire et Cellulaire Illkirch Cedex, C.U. Equipe Labélisée Ligue contre le Cancer, Strasbourg, France., IGBMC, Institut de Génétique et de Biologie Moléculaire et Cellulaire Illkirch Cedex, C.U. Equipe Labélisée Ligue contre le Cancer, Strasbourg, France., IGBMC, Institut de Génétique et de Biologie Moléculaire et Cellulaire Illkirch Cedex, C.U. Equipe Labélisée Ligue contre le Cancer, Strasbourg, France., IGBMC, Institut de Génétique et de Biologie Moléculaire et Cellulaire Illkirch Cedex, C.U. Equipe Labélisée Ligue contre le Cancer, Strasbourg, France., IGBMC, Institut de Génétique et de Biologie Moléculaire et Cellulaire Illkirch Cedex, C.U. Equipe Labélisée Ligue contre le Cancer, Strasbourg, France., IGBMC, Institut de Génétique et de Biologie Moléculaire et Cellulaire Illkirch Cedex, C.U. Equipe Labélisée Ligue contre le Cancer, Strasbourg, France., IGBMC, Institut de Génétique et de Biologie Moléculaire et Cellulaire Illkirch Cedex, C.U. Equipe Labélisée Ligue contre le Cancer, Strasbourg, France., IGBMC, Institut de Génétique et de Biologie Moléculaire et Cellulaire Illkirch Cedex, C.U. Equipe Labélisée Ligue contre le Cancer, Strasbourg, France., IGBMC, Institut de Génétique et de Biologie Moléculaire et Cellulaire Illkirch Cedex, C.U. Equipe Labélisée Ligue contre le Cancer, Strasbourg, France., Cell Biology Department, Research and Development, PharmaMar SA, Colmenar Vejo, Spain., Cell Biology Department, Research and Development, PharmaMar SA, Colmenar Vejo, Spain., Cell Biology Department, Research and Development, PharmaMar SA, Colmenar Vejo, Spain., IGBMC, Institut de Génétique et de Biologie Moléculaire et Cellulaire Illkirch Cedex, C.U. Equipe Labélisée Ligue contre le Cancer, Strasbourg, France., Cell Biology Department, Research and Development, PharmaMar SA, Colmenar Vejo, Spain., IGBMC, Institut de Génétique et de Biologie Moléculaire et Cellulaire Illkirch Cedex, C.U. Equipe Labélisée Ligue contre le Cancer, Strasbourg, France., IGBMC, Institut de Génétique et de Biologie Moléculaire et Cellulaire Illkirch Cedex, C.U. Equipe Labélisée Ligue contre le Cancer, Strasbourg, France., Cell Biology Department, Research and Development, PharmaMar SA, Colmenar Vejo, Spain., IGBMC, Institut de Génétique et de Biologie Moléculaire et Cellulaire Illkirch Cedex, C.U. Equipe Labélisée Ligue contre le Cancer, Strasbourg, France. fredr@igbmc.fr.",fredr@igbmc.fr.
39779686,Integrating gene therapy into the treatment paradigm for non-muscle invasive bladder cancer.,2025-Jan-09,"Behzad Jazayeri, Roger Li","Department of Urology, Moffitt Cancer Center, Tampa, FL, USA., Department of Urology, Moffitt Cancer Center, Tampa, FL, USA.",
39779664,CCR5-ligand decorated rilpivirine lipid-based nanoparticles for sustained antiretroviral responses.,2025-Jan-08,,,
39779635,Dual targeting of HSP90 and BCL-2 in breast cancer cells using inhibitors BIIB021 and ABT-263.,2025-Jan-09,,,
39779619,Angelica gigas Nakai (Korean Dang-gui) Root Alcoholic Extracts in Health Promotion and Disease Therapy - active Phytochemicals and In Vivo Molecular Targets.,2025-Jan-08,,,
39779616,Cardiotoxicity as important differential diagnosis for reduced myocardial blood flow during Rubidium cardiac PET/CT : Cardiotoxicity in Rubidium PET/CT.,2025-Jan-08,,,
39779611,Treatment outcomes and prognostic factors in patients with colorectal cancer and synchronous lung metastases in the conversion therapy era.,2025-Jan-09,,,
39779600,Analysis of mRNA Pentatricopeptide Repeat Domain 1 as a prospective oncogene in clear cell renal cell carcinoma that accelerates tumor cells proliferation and invasion via the Akt/GSK3β/β-catenin pathway.,2025-Jan-08,,,
39779574,The Clinical Role of Hypoxia Inducible Factor (HIF) Inhibition in Renal Cancer: A Focus on Belzutifan.,2025-Jan-06,"Chiara Ciccarese, Giampaolo Tortora, Roberto Iacovelli","Medical Oncology, Department of Medical and Surgical Sciences, Fondazione Policlinico Universitario Agostino Gemelli IRCCS, Rome, Italy., Medical Oncology, Department of Medical and Surgical Sciences, Fondazione Policlinico Universitario Agostino Gemelli IRCCS, Rome, Italy., Medical Oncology, Department of Medical and Surgical Sciences, Fondazione Policlinico Universitario Agostino Gemelli IRCCS, Rome, Italy.",
39779573,Clinical Application of PARP1 Inhibitors and Challenges in Cancer Therapy.,2025-Jan-06,,,
39779571,"Design and Evaluation of 5-Oxo-1,2,4-triazole-3-carboxamide Compounds as Promising Anticancer Agents: Synthesis, Characterization, In vitro Cytotoxicity and Molecular Docking Studies.",2025-Jan-06,,,
39779562,"A Single-Arm, Open-Label, Phase Ib Clinical Study Evaluating the Efficacy and Safety of Durvalumab in Combination with Albumin-Bound Paclitaxel and Carboplatin as Neoadjuvant Therapy for Resectable Stage III Non-Small Cell Lung Cancer.",2025-Jan-06,,,
